BOAMP_AVIS_NUM,D_10_01_Annulation_Annulinfoannonceanterieur,D_10_01_01_Annulation_Annulinfoannonceanterieur_Reference,D_10_01_01_01_Annulation_Annulinfoannonceanterieur_Reference_Idweb,D_10_01_01_02_Annulation_Annulinfoannonceanterieur_Reference_Typeavis,D_10_01_01_02_01_Annulation_Annulinfoannonceanterieur_Reference_Typeavis_Famille,D_10_01_01_02_01_01_Annulation_Annulinfoannonceanterieur_Reference_Typeavis_Famille_Mapa,D_10_01_01_02_01_02_Annulation_Annulinfoannonceanterieur_Reference_Typeavis_Famille_Fns,D_10_01_01_02_01_03_Annulation_Annulinfoannonceanterieur_Reference_Typeavis_Famille_Joue,D_10_01_01_02_01_04_Annulation_Annulinfoannonceanterieur_Reference_Typeavis_Famille_Dsp,D_10_01_01_02_01_05_Annulation_Annulinfoannonceanterieur_Reference_Typeavis_Famille_Divers,D_10_01_01_02_02_Annulation_Annulinfoannonceanterieur_Reference_Typeavis_Perimetre,D_10_01_01_02_02_01_Annulation_Annulinfoannonceanterieur_Reference_Typeavis_Perimetre_Cmp2006,D_10_01_01_02_02_02_Annulation_Annulinfoannonceanterieur_Reference_Typeavis_Perimetre_Cmp2006DEFENSE,D_10_01_01_02_02_03_Annulation_Annulinfoannonceanterieur_Reference_Typeavis_Perimetre_Directive18,D_10_01_01_02_02_04_Annulation_Annulinfoannonceanterieur_Reference_Typeavis_Perimetre_Directive17,D_10_01_01_02_02_05_Annulation_Annulinfoannonceanterieur_Reference_Typeavis_Perimetre_Directive81,D_10_01_01_02_02_06_Annulation_Annulinfoannonceanterieur_Reference_Typeavis_Perimetre_Directive23,D_10_01_01_02_02_07_Annulation_Annulinfoannonceanterieur_Reference_Typeavis_Perimetre_Directive24,D_10_01_01_02_02_08_Annulation_Annulinfoannonceanterieur_Reference_Typeavis_Perimetre_Directive25,D_10_01_01_02_02_09_Annulation_Annulinfoannonceanterieur_Reference_Typeavis_Perimetre_Dsp,D_10_01_01_02_02_10_Annulation_Annulinfoannonceanterieur_Reference_Typeavis_Perimetre_Autre,D_10_01_01_02_03_Annulation_Annulinfoannonceanterieur_Reference_Typeavis_Nature,D_10_01_01_02_03_01_Annulation_Annulinfoannonceanterieur_Reference_Typeavis_Nature_Preinformation,D_10_01_01_02_03_02_Annulation_Annulinfoannonceanterieur_Reference_Typeavis_Nature_Profilacheteur,D_10_01_01_02_03_03_Annulation_Annulinfoannonceanterieur_Reference_Typeavis_Nature_Appeloffre,D_10_01_01_02_03_03_01_Annulation_Annulinfoannonceanterieur_Reference_Typeavis_Nature_Appeloffre_Standard,D_10_01_01_02_03_03_02_Annulation_Annulinfoannonceanterieur_Reference_Typeavis_Nature_Appeloffre_Concours,D_10_01_01_02_03_03_03_Annulation_Annulinfoannonceanterieur_Reference_Typeavis_Nature_Appeloffre_Periodique,D_10_01_01_02_03_03_04_Annulation_Annulinfoannonceanterieur_Reference_Typeavis_Nature_Appeloffre_Qualification,D_10_01_01_02_03_03_05_Annulation_Annulinfoannonceanterieur_Reference_Typeavis_Nature_Appeloffre_Sad,D_10_01_01_02_03_03_06_Annulation_Annulinfoannonceanterieur_Reference_Typeavis_Nature_Appeloffre_Concession,D_10_01_01_02_03_03_07_Annulation_Annulinfoannonceanterieur_Reference_Typeavis_Nature_Appeloffre_Concessionnaire,D_10_01_01_02_03_04_Annulation_Annulinfoannonceanterieur_Reference_Typeavis_Nature_Intentionconclure,D_10_01_01_02_03_05_Annulation_Annulinfoannonceanterieur_Reference_Typeavis_Nature_Attribution,D_10_01_01_02_03_05_01_Annulation_Annulinfoannonceanterieur_Reference_Typeavis_Nature_Attribution_Standard,D_10_01_01_02_03_05_02_Annulation_Annulinfoannonceanterieur_Reference_Typeavis_Nature_Attribution_Concours,D_10_01_01_02_03_05_03_Annulation_Annulinfoannonceanterieur_Reference_Typeavis_Nature_Attribution_Concession,D_10_01_01_02_03_05_04_Annulation_Annulinfoannonceanterieur_Reference_Typeavis_Nature_Attribution_Standardinfructueuxsanssuite,D_10_01_01_02_03_06_Annulation_Annulinfoannonceanterieur_Reference_Typeavis_Nature_Soustraitance,D_10_01_01_02_03_07_Annulation_Annulinfoannonceanterieur_Reference_Typeavis_Nature_Modification,D_10_01_01_02_03_08_Annulation_Annulinfoannonceanterieur_Reference_Typeavis_Nature_Qualification,D_10_01_01_02_03_09_Annulation_Annulinfoannonceanterieur_Reference_Typeavis_Nature_Rectificatif,D_10_01_01_02_03_10_Annulation_Annulinfoannonceanterieur_Reference_Typeavis_Nature_Periodique,D_10_01_01_02_03_11_Annulation_Annulinfoannonceanterieur_Reference_Typeavis_Nature_Autre,D_10_01_01_02_04_Annulation_Annulinfoannonceanterieur_Reference_Typeavis_Statut,D_10_01_01_02_04_01_Annulation_Annulinfoannonceanterieur_Reference_Typeavis_Statut_Initial,D_10_01_01_02_04_02_Annulation_Annulinfoannonceanterieur_Reference_Typeavis_Statut_Rectificatif,D_10_01_01_02_04_03_Annulation_Annulinfoannonceanterieur_Reference_Typeavis_Statut_Annulation,D_10_01_01_02_04_04_Annulation_Annulinfoannonceanterieur_Reference_Typeavis_Statut_Modification,D_10_01_01_03_Annulation_Annulinfoannonceanterieur_Reference_Dateenvoi,D_10_01_02_Annulation_Annulinfoannonceanterieur_Referencepublication,D_10_01_02_01_Annulation_Annulinfoannonceanterieur_Referencepublication_Publicationpapier,D_10_01_02_02_Annulation_Annulinfoannonceanterieur_Referencepublication_Publicationelectronique,D_10_01_02_02_01_Annulation_Annulinfoannonceanterieur_Referencepublication_Publicationelectronique_Datepublication,D_10_01_02_02_02_Annulation_Annulinfoannonceanterieur_Referencepublication_Publicationelectronique_Datefindiffusion,D_10_01_02_03_Annulation_Annulinfoannonceanterieur_Referencepublication_Publicationjoue,D_10_01_02_03_01_Annulation_Annulinfoannonceanterieur_Referencepublication_Publicationjoue_Annee,D_10_01_02_03_02_Annulation_Annulinfoannonceanterieur_Referencepublication_Publicationjoue_Numparution,D_10_01_02_03_03_Annulation_Annulinfoannonceanterieur_Referencepublication_Publicationjoue_Numannonce,D_10_01_02_03_04_Annulation_Annulinfoannonceanterieur_Referencepublication_Publicationjoue_Datepublication,D_10_02_Annulation_Motif
20-16675,CF_NIV_SUIV,CF_NIV_SUIV,20-13042,CF_NIV_SUIV,CF_NIV_SUIV,False,True,False,,,CF_NIV_SUIV,True,,,,False,,,,,,CF_NIV_SUIV,,,CF_NIV_SUIV,,,,,,,,,CF_NIV_SUIV,,,,,,,,,,,CF_NIV_SUIV,True,,,,,CF_NIV_SUIV,[],CF_NIV_SUIV,2020-01-26 23:00:00,2020-02-24 23:00:00,CF_NIV_SUIV,,,,,erreur matérielle.La procédure sera relancée prochainement.
20-17117,CF_NIV_SUIV,CF_NIV_SUIV,20-16011,CF_NIV_SUIV,CF_NIV_SUIV,True,False,False,,,CF_NIV_SUIV,True,,,,False,,,,,,CF_NIV_SUIV,,,CF_NIV_SUIV,,,,,,,,,CF_NIV_SUIV,,,,,,,,,,,CF_NIV_SUIV,True,,,,,CF_NIV_SUIV,[],CF_NIV_SUIV,2020-01-30 23:00:00,2020-03-04 23:00:00,CF_NIV_SUIV,,,,,Procédure adaptée supérieur à 90 000 ? HT
20-17148,CF_NIV_SUIV,CF_NIV_SUIV,20-16660,CF_NIV_SUIV,CF_NIV_SUIV,True,False,False,,,CF_NIV_SUIV,True,,,,False,,,,,,CF_NIV_SUIV,,,CF_NIV_SUIV,,,,,,,,,CF_NIV_SUIV,,,,,,,,,,,CF_NIV_SUIV,True,,,,,CF_NIV_SUIV,[],CF_NIV_SUIV,2020-02-02 23:00:00,2020-02-16 23:00:00,CF_NIV_SUIV,,,,,Erreur de support de publication
20-17772,CF_NIV_SUIV,CF_NIV_SUIV,20-9328,CF_NIV_SUIV,CF_NIV_SUIV,False,True,False,,,CF_NIV_SUIV,True,,,,False,,,,,,CF_NIV_SUIV,,,CF_NIV_SUIV,,,,,,,,,CF_NIV_SUIV,,,,,,,,,,,CF_NIV_SUIV,True,,,,,CF_NIV_SUIV,[],CF_NIV_SUIV,2020-01-20 23:00:00,2020-02-16 23:00:00,CF_NIV_SUIV,,,,,La procédure est déclarée sans suite pour motif d'intérêt général
20-17856,CF_NIV_SUIV,CF_NIV_SUIV,20-15341,CF_NIV_SUIV,CF_NIV_SUIV,False,True,False,,,CF_NIV_SUIV,True,,,,False,,,,,,CF_NIV_SUIV,,,CF_NIV_SUIV,,,,,,,,,CF_NIV_SUIV,,,,,,,,,,,CF_NIV_SUIV,True,,,,,CF_NIV_SUIV,[],CF_NIV_SUIV,2020-01-30 23:00:00,2020-03-05 23:00:00,CF_NIV_SUIV,,,,,"Cette consultation est annulée pour motif d'intérêt général, notamment consolider le plan de financement et le montant des aides financières."
20-18430,CF_NIV_SUIV,CF_NIV_SUIV,20-17294,CF_NIV_SUIV,CF_NIV_SUIV,False,True,False,,,CF_NIV_SUIV,True,,,,False,,,,,,CF_NIV_SUIV,,,CF_NIV_SUIV,,,,,,,,,CF_NIV_SUIV,,,,,,,,,,,CF_NIV_SUIV,True,,,,,CF_NIV_SUIV,[],CF_NIV_SUIV,2020-02-03 23:00:00,2020-03-11 23:00:00,CF_NIV_SUIV,,,,,"Erreur de saisie, la publicité est un avis JOUE car il s'agit d'un appel d'offres européen"
20-18895,CF_NIV_SUIV,CF_NIV_SUIV,20-5498,CF_NIV_SUIV,CF_NIV_SUIV,False,True,False,,,CF_NIV_SUIV,True,,,,False,,,,,,CF_NIV_SUIV,,,CF_NIV_SUIV,,,,,,,,,CF_NIV_SUIV,,,,,,,,,,,CF_NIV_SUIV,True,,,,,CF_NIV_SUIV,[],CF_NIV_SUIV,2020-01-13 23:00:00,2020-03-30 22:00:00,CF_NIV_SUIV,,,,,Procédure déclarée sans suite pour motif d'intérêt général
20-21606,CF_NIV_SUIV,CF_NIV_SUIV,19-189913,CF_NIV_SUIV,CF_NIV_SUIV,True,False,False,,,CF_NIV_SUIV,True,,,,False,,,,,,CF_NIV_SUIV,,,CF_NIV_SUIV,,,,,,,,,CF_NIV_SUIV,,,,,,,,,,,CF_NIV_SUIV,True,,,,,CF_NIV_SUIV,[],CF_NIV_SUIV,2019-12-19 23:00:00,2020-01-09 23:00:00,CF_NIV_SUIV,,,,,"La procédure de passation est déclarée sans suite pour motif d'intérêt général fondé sur le besoin du pouvoir adjudicateur. En effet, le besoin doit être redéfini."
20-22053,CF_NIV_SUIV,CF_NIV_SUIV,20-19111,CF_NIV_SUIV,CF_NIV_SUIV,True,False,False,,,CF_NIV_SUIV,True,,,,False,,,,,,CF_NIV_SUIV,,,CF_NIV_SUIV,,,,,,,,,CF_NIV_SUIV,,,,,,,,,,,CF_NIV_SUIV,True,,,,,CF_NIV_SUIV,[],CF_NIV_SUIV,2020-02-05 23:00:00,2020-02-24 23:00:00,CF_NIV_SUIV,,,,,La consultation a été clôturée ( modalités de publicité insuffisantes : éléments relatifs au contenu de la candidature manquants)Relancée ce jour avec une date de dépôt de candidature fixée au 28.02.2020 à 16h00
20-24442,CF_NIV_SUIV,CF_NIV_SUIV,19-188556,CF_NIV_SUIV,CF_NIV_SUIV,True,False,False,,,CF_NIV_SUIV,True,,,,False,,,,,,CF_NIV_SUIV,,,CF_NIV_SUIV,,,,,,,,,CF_NIV_SUIV,,,,,,,,,,,CF_NIV_SUIV,True,,,,,CF_NIV_SUIV,[],CF_NIV_SUIV,2019-12-17 23:00:00,2020-01-10 23:00:00,CF_NIV_SUIV,,,,,La consultation est déclarée sans suite pour motif d'intérêt général.
20-24836,CF_NIV_SUIV,CF_NIV_SUIV,19-190998,CF_NIV_SUIV,CF_NIV_SUIV,True,False,False,,,CF_NIV_SUIV,True,,,,False,,,,,,CF_NIV_SUIV,,,CF_NIV_SUIV,,,,,,,,,CF_NIV_SUIV,,,,,,,,,,,CF_NIV_SUIV,True,,,,,CF_NIV_SUIV,[],CF_NIV_SUIV,2019-12-22 23:00:00,2020-01-21 23:00:00,CF_NIV_SUIV,,,,,Le marché est déclaré sans suite pour motif d'intérêt général.
20-24887,CF_NIV_SUIV,CF_NIV_SUIV,20-19984,CF_NIV_SUIV,CF_NIV_SUIV,True,False,False,,,CF_NIV_SUIV,True,,,,False,,,,,,CF_NIV_SUIV,,,CF_NIV_SUIV,,,,,,,,,CF_NIV_SUIV,,,,,,,,,,,CF_NIV_SUIV,True,,,,,CF_NIV_SUIV,[],CF_NIV_SUIV,2020-02-06 23:00:00,2020-03-05 23:00:00,CF_NIV_SUIV,,,,,"La ville de Caen n'étant pas le pouvoir adjudicateur à l'origine de ce marché, une nouvelle consultation sera prochainement lancée par la Communauté urbaine Caen la mer, entité compétente."
20-25554,CF_NIV_SUIV,CF_NIV_SUIV,19-187571,CF_NIV_SUIV,CF_NIV_SUIV,False,True,False,,,CF_NIV_SUIV,True,,,,False,,,,,,CF_NIV_SUIV,,,CF_NIV_SUIV,,,,,,,,,CF_NIV_SUIV,,,,,,,,,,,CF_NIV_SUIV,True,,,,,CF_NIV_SUIV,[],CF_NIV_SUIV,2020-01-16 23:00:00,2020-02-13 23:00:00,CF_NIV_SUIV,,,,,Le pouvoir adjudicateur a décidé de déclarer sans suite la consultation relative au remplacement des menuiseries extérieures et de l'isolation thermique à la MIE de Denain par arrêté A20/199 en date du 18 février 2020.Cette déclaration est motivée par le souci de garantir l'efficacité de la commande publique en écartant les risques tenant aux incertitudes ayant affecté la consultation des entreprises.
20-25587,CF_NIV_SUIV,CF_NIV_SUIV,20-24900,CF_NIV_SUIV,CF_NIV_SUIV,False,True,False,,,CF_NIV_SUIV,True,,,,False,,,,,,CF_NIV_SUIV,,,CF_NIV_SUIV,,,,,,,,,CF_NIV_SUIV,,,,,,,,,,,CF_NIV_SUIV,True,,,,,CF_NIV_SUIV,[],CF_NIV_SUIV,2020-02-17 23:00:00,2020-03-17 23:00:00,CF_NIV_SUIV,,,,,Consultation sans suite pour motif juridique
19-180010,CF_NIV_SUIV,CF_NIV_SUIV,19-178917,CF_NIV_SUIV,CF_NIV_SUIV,True,False,False,,,CF_NIV_SUIV,True,,,,False,,,,,,CF_NIV_SUIV,,,CF_NIV_SUIV,,,,,,,,,CF_NIV_SUIV,,,,,,,,,,,CF_NIV_SUIV,True,,,,,CF_NIV_SUIV,[],CF_NIV_SUIV,2019-11-27 23:00:00,2019-12-19 23:00:00,CF_NIV_SUIV,,,,,le montant du marché ne correspond pas à la publication légale à mettre en place
20-26679,CF_NIV_SUIV,CF_NIV_SUIV,20-24793,CF_NIV_SUIV,CF_NIV_SUIV,True,False,False,,,CF_NIV_SUIV,True,,,,False,,,,,,CF_NIV_SUIV,,,CF_NIV_SUIV,,,,,,,,,CF_NIV_SUIV,,,,,,,,,,,CF_NIV_SUIV,True,,,,,CF_NIV_SUIV,[],CF_NIV_SUIV,2020-02-16 23:00:00,2020-03-05 23:00:00,CF_NIV_SUIV,,,,,AVIS DE CONSULTATION ANNULÉ - ET DÉCLARÉ SANS SUITE - EN RAISON D'UNE ERREUR MATÉRIELLE DE CALENDRIER DES MARCHES EN COURS D'EXÉCUTION
20-27003,CF_NIV_SUIV,CF_NIV_SUIV,20-26775,CF_NIV_SUIV,CF_NIV_SUIV,False,True,False,,,CF_NIV_SUIV,True,,,,False,,,,,,CF_NIV_SUIV,,,CF_NIV_SUIV,,,,,,,,,CF_NIV_SUIV,,,,,,,,,,,CF_NIV_SUIV,True,,,,,CF_NIV_SUIV,[],CF_NIV_SUIV,2020-02-19 23:00:00,2020-03-22 23:00:00,CF_NIV_SUIV,,,,,Procédure restreinte qui a déjà fait l'objet d'un Appel à candidatures. Donc pas besoin d'être publié au BOAMP
20-27137,CF_NIV_SUIV,CF_NIV_SUIV,20-22737,CF_NIV_SUIV,CF_NIV_SUIV,False,True,False,,,CF_NIV_SUIV,True,,,,False,,,,,,CF_NIV_SUIV,,,CF_NIV_SUIV,,,,,,,,,CF_NIV_SUIV,,,,,,,,,,,CF_NIV_SUIV,True,,,,,CF_NIV_SUIV,[],CF_NIV_SUIV,2020-02-12 23:00:00,2020-03-12 23:00:00,CF_NIV_SUIV,,,,,Des prestations supplémentaires vont modifier de façon substantielle le marché. Il sera de nouveau publié.
20-27250,CF_NIV_SUIV,CF_NIV_SUIV,20-23978,CF_NIV_SUIV,CF_NIV_SUIV,False,True,False,,,CF_NIV_SUIV,True,,,,False,,,,,,CF_NIV_SUIV,,,CF_NIV_SUIV,,,,,,,,,CF_NIV_SUIV,,,,,,,,,,,CF_NIV_SUIV,True,,,,,CF_NIV_SUIV,[],CF_NIV_SUIV,2020-02-13 23:00:00,2020-03-08 23:00:00,CF_NIV_SUIV,,,,,"Suite à des difficultés d'organisation matérielle du service, ce marché est annulé et sera republié ultérieurement.Bien cordialementM. MEUNIER Jérôme,Directeur de la RASL"
20-27298,CF_NIV_SUIV,CF_NIV_SUIV,20-25078,CF_NIV_SUIV,CF_NIV_SUIV,False,True,False,,,CF_NIV_SUIV,True,,,,False,,,,,,CF_NIV_SUIV,,,CF_NIV_SUIV,,,,,,,,,CF_NIV_SUIV,,,,,,,,,,,CF_NIV_SUIV,True,,,,,CF_NIV_SUIV,[],CF_NIV_SUIV,2020-02-17 23:00:00,2020-03-08 23:00:00,CF_NIV_SUIV,,,,,Annonce supprimée
20-28236,CF_NIV_SUIV,CF_NIV_SUIV,20-14635,CF_NIV_SUIV,CF_NIV_SUIV,False,False,False,,"<?xml version=""1.0"" encoding=""UTF-16""?>
<DIVERS xmlns:xsi=""http://www.w3.org/2001/XMLSchema-instance""/>",CF_NIV_SUIV,False,,,,False,,,,,,CF_NIV_SUIV,,,CF_NIV_SUIV,,,,,,,,,CF_NIV_SUIV,,,,,,,,,,,CF_NIV_SUIV,True,,,,,CF_NIV_SUIV,[],CF_NIV_SUIV,2020-02-02 23:00:00,2020-03-03 23:00:00,CF_NIV_SUIV,,,,,Des rectifications dans ce DCE oblige la commune à annuler cette publication.
20-28343,CF_NIV_SUIV,CF_NIV_SUIV,20-26027,CF_NIV_SUIV,CF_NIV_SUIV,False,True,False,,,CF_NIV_SUIV,True,,,,False,,,,,,CF_NIV_SUIV,,,CF_NIV_SUIV,,,,,,,,,CF_NIV_SUIV,,,,,,,,,,,CF_NIV_SUIV,True,,,,,CF_NIV_SUIV,[],CF_NIV_SUIV,2020-02-18 23:00:00,2020-03-15 23:00:00,CF_NIV_SUIV,,,,,Nécessité de modifier le dossier de consultation
20-28412,CF_NIV_SUIV,CF_NIV_SUIV,20-22944,CF_NIV_SUIV,CF_NIV_SUIV,False,True,False,,,CF_NIV_SUIV,True,,,,False,,,,,,CF_NIV_SUIV,,,CF_NIV_SUIV,,,,,,,,,CF_NIV_SUIV,,,,,,,,,,,CF_NIV_SUIV,True,,,,,CF_NIV_SUIV,[],CF_NIV_SUIV,2020-02-12 23:00:00,2020-03-09 23:00:00,CF_NIV_SUIV,,,,,La procédure est déclarée sans suite. Une nouvelle mise en concurrence sera prochainement organisée sur la base d'un cahier des charges modifié.
20-28534,CF_NIV_SUIV,CF_NIV_SUIV,20-17523,CF_NIV_SUIV,CF_NIV_SUIV,True,False,False,,,CF_NIV_SUIV,True,,,,False,,,,,,CF_NIV_SUIV,,,CF_NIV_SUIV,,,,,,,,,CF_NIV_SUIV,,,,,,,,,,,CF_NIV_SUIV,True,,,,,CF_NIV_SUIV,[],CF_NIV_SUIV,2020-02-03 23:00:00,2020-03-30 22:00:00,CF_NIV_SUIV,,,,,Le marché public N°20-005 (publication boamp no20-17523 ) ayant pour objet la réalisation d'un relevé géomètre des bâtiments et abords dans le cadre de l'opération de restructuration et extension du service des Urgences du centre hospitalier de Carpentras est annulé.Cette annulation fait suite à certaines anomalies dans la procédure et permet de préserver l'égalité entre les candidatsCette consultation sera relancée dans les jours à venir.
20-28540,CF_NIV_SUIV,CF_NIV_SUIV,20-28064,CF_NIV_SUIV,CF_NIV_SUIV,False,True,False,,,CF_NIV_SUIV,True,,,,False,,,,,,CF_NIV_SUIV,,,CF_NIV_SUIV,,,,,,,,,CF_NIV_SUIV,,,,,,,,,,,CF_NIV_SUIV,True,,,,,CF_NIV_SUIV,[],CF_NIV_SUIV,2020-02-23 23:00:00,2020-04-05 22:00:00,CF_NIV_SUIV,,,,,Modification de certaines clauses du marché ainsi que le seuil de procédure > 90 000 euro(s)
20-28828,CF_NIV_SUIV,CF_NIV_SUIV,20-20121,CF_NIV_SUIV,CF_NIV_SUIV,True,False,False,,,CF_NIV_SUIV,True,,,,False,,,,,,CF_NIV_SUIV,,,CF_NIV_SUIV,,,,,,,,,CF_NIV_SUIV,,,,,,,,,,,CF_NIV_SUIV,True,,,,,CF_NIV_SUIV,[],CF_NIV_SUIV,2020-02-07 23:00:00,2020-03-27 23:00:00,CF_NIV_SUIV,,,,,Évolution du besoin.
20-29679,CF_NIV_SUIV,CF_NIV_SUIV,20-20122,CF_NIV_SUIV,CF_NIV_SUIV,True,False,False,,,CF_NIV_SUIV,True,,,,False,,,,,,CF_NIV_SUIV,,,CF_NIV_SUIV,,,,,,,,,CF_NIV_SUIV,,,,,,,,,,,CF_NIV_SUIV,True,,,,,CF_NIV_SUIV,[],CF_NIV_SUIV,2020-02-07 23:00:00,2020-03-27 23:00:00,CF_NIV_SUIV,,,,,Evolution du besoin.
20-29836,CF_NIV_SUIV,CF_NIV_SUIV,20-29295,CF_NIV_SUIV,CF_NIV_SUIV,False,True,False,,,CF_NIV_SUIV,True,,,,False,,,,,,CF_NIV_SUIV,,,CF_NIV_SUIV,,,,,,,,,CF_NIV_SUIV,,,,,,,,,,,CF_NIV_SUIV,True,,,,,CF_NIV_SUIV,[],CF_NIV_SUIV,2020-02-25 23:00:00,2020-03-22 23:00:00,CF_NIV_SUIV,,,,,Montant du marché erroné
20-30369,CF_NIV_SUIV,CF_NIV_SUIV,19-72778,CF_NIV_SUIV,CF_NIV_SUIV,False,True,False,,,CF_NIV_SUIV,True,,,,False,,,,,,CF_NIV_SUIV,,,CF_NIV_SUIV,,,,,,,,,CF_NIV_SUIV,,,,,,,,,,,CF_NIV_SUIV,True,,,,,CF_NIV_SUIV,[],CF_NIV_SUIV,2019-05-08 22:00:00,2019-06-08 22:00:00,CF_NIV_SUIV,,,,,"En raison de la redéfinition du besoin entrainant la suppression d'une partie des prestations, s'agissant des lots 3 et 5, il a été décidé par décision du 25/02/2020 du Directeur Général de la RTM, de ne pas donner suite aux lots susvisés, pour motif d'intérêt général, en application de l'article R2185-1 du code de la commande publique."
20-30805,CF_NIV_SUIV,CF_NIV_SUIV,19-159705,CF_NIV_SUIV,CF_NIV_SUIV,False,True,False,,,CF_NIV_SUIV,True,,,,False,,,,,,CF_NIV_SUIV,,,CF_NIV_SUIV,,,,,,,,,CF_NIV_SUIV,,,,,,,,,,,CF_NIV_SUIV,True,,,,,CF_NIV_SUIV,[],CF_NIV_SUIV,2019-10-20 22:00:00,2019-11-20 23:00:00,CF_NIV_SUIV,,,,,Motif d'intérêt général
