20-42666,CF_NIV_SUIV,CF_NIV_SUIV,20-27470,CF_NIV_SUIV,CF_NIV_SUIV,True,False,False,,,CF_NIV_SUIV,True,,,,False,,,,,,CF_NIV_SUIV,,,CF_NIV_SUIV,,,,,,,,,CF_NIV_SUIV,,,,,,,,,,,CF_NIV_SUIV,True,,,,,CF_NIV_SUIV,[],CF_NIV_SUIV,2020-02-20 23:00:00,2020-03-17 23:00:00,CF_NIV_SUIV,,,,,"Suite à une erreur matérielle quant aux dates de remise des offres, cette consultation est annulée. une nouvelle consultation sera lancée ultérieurement"
20-42724,CF_NIV_SUIV,CF_NIV_SUIV,20-30659,CF_NIV_SUIV,CF_NIV_SUIV,False,True,False,,,CF_NIV_SUIV,True,,,,False,,,,,,CF_NIV_SUIV,,,CF_NIV_SUIV,,,,,,,,,CF_NIV_SUIV,,,,,,,,,,,CF_NIV_SUIV,True,,,,,CF_NIV_SUIV,[],CF_NIV_SUIV,2020-02-27 23:00:00,2020-03-26 23:00:00,CF_NIV_SUIV,,,,,"En raison des circonstances actuelles, et afin de garantir l'égalité de traitement des candidats, la consultation est annulée. Elle sera relancée ultérieurement."
20-43002,CF_NIV_SUIV,CF_NIV_SUIV,20-34278,CF_NIV_SUIV,CF_NIV_SUIV,False,True,False,,,CF_NIV_SUIV,True,,,,False,,,,,,CF_NIV_SUIV,,,CF_NIV_SUIV,,,,,,,,,CF_NIV_SUIV,,,,,,,,,,,CF_NIV_SUIV,True,,,,,CF_NIV_SUIV,[],CF_NIV_SUIV,2020-03-05 23:00:00,2020-04-01 22:00:00,CF_NIV_SUIV,,,,,"Compte tenu de la situation actuelle liée à la pandémie (Covid -19), nous sommes dans l'impossibilité de maintenir les visites programmées. La présente consultation est donc interrompue. Dès que la situation sanitaire le permettra, la consultation sera réactivée."
20-43064,CF_NIV_SUIV,CF_NIV_SUIV,20-26333,CF_NIV_SUIV,CF_NIV_SUIV,False,True,False,,,CF_NIV_SUIV,True,,,,False,,,,,,CF_NIV_SUIV,,,CF_NIV_SUIV,,,,,,,,,CF_NIV_SUIV,,,,,,,,,,,CF_NIV_SUIV,True,,,,,CF_NIV_SUIV,[],CF_NIV_SUIV,2020-02-19 23:00:00,2020-03-22 23:00:00,CF_NIV_SUIV,,,,,"Suite aux mesures de confinement décidées par le gouvernement afin de limiter la propagation du Covid-19, la présente consultation est déclarée sans suite conformément à l'article R.2185-1 du Code de la commande publique. Les exigences du dossier de consultation et plus particulièrement du règlement de la consultation (remise d'échantillons soit par dépôt dans les locaux du pouvoir adjudicateur soit par envoi avec accusé de réception) nécessitent d'être redéfinies en raison du fonctionnement réduit des entreprises et de la fermeture au public de l'accueil du pouvoir adjudicateur. En effet, le bon acheminement des échantillons n'est plus garanti."
20-43176,CF_NIV_SUIV,CF_NIV_SUIV,20-32836,CF_NIV_SUIV,CF_NIV_SUIV,True,False,False,,,CF_NIV_SUIV,True,,,,False,,,,,,CF_NIV_SUIV,,,CF_NIV_SUIV,,,,,,,,,CF_NIV_SUIV,,,,,,,,,,,CF_NIV_SUIV,True,,,,,CF_NIV_SUIV,[],CF_NIV_SUIV,2020-03-03 23:00:00,2020-03-23 23:00:00,CF_NIV_SUIV,,,,,"Compte tenu de la situation actuelle liée à la pandémie (Covid -19), nous sommes dans l'impossibilité de maintenir les visites. La présente consultation est donc interrompue. Dès que la situation sanitaire le permettra, la consultation sera réactivée."
20-43203,CF_NIV_SUIV,CF_NIV_SUIV,20-36650,CF_NIV_SUIV,CF_NIV_SUIV,False,True,False,,,CF_NIV_SUIV,True,,,,False,,,,,,CF_NIV_SUIV,,,CF_NIV_SUIV,,,,,,,,,CF_NIV_SUIV,,,,,,,,,,,CF_NIV_SUIV,True,,,,,CF_NIV_SUIV,[],CF_NIV_SUIV,2020-03-09 23:00:00,2020-04-13 22:00:00,CF_NIV_SUIV,,,,,"suite aux conditions sanitaires particulières que nous connaissons actuellement, la visite obligatoire prévue dans le dossier de consultation ne pourra avoir lieu. Part conséquent l'avis de publicité est annulé et sera reporté à une date ultérieure.Merci de votre compréhension"
20-43292,CF_NIV_SUIV,CF_NIV_SUIV,20-35235,CF_NIV_SUIV,CF_NIV_SUIV,False,True,False,,,CF_NIV_SUIV,True,,,,False,,,,,,CF_NIV_SUIV,,,CF_NIV_SUIV,,,,,,,,,CF_NIV_SUIV,,,,,,,,,,,CF_NIV_SUIV,True,,,,,CF_NIV_SUIV,[],CF_NIV_SUIV,2020-03-08 23:00:00,2020-04-05 22:00:00,CF_NIV_SUIV,,,,,"Compte tenu du contexte sanitaire actuel, le pouvoir adjudicateur a décidé d'annuler la consultation pour la relancer ultérieurement lorsque des délais d'exécution plus précis pourront être établis"
20-43305,CF_NIV_SUIV,CF_NIV_SUIV,20-29300,CF_NIV_SUIV,CF_NIV_SUIV,False,True,False,,,CF_NIV_SUIV,True,,,,False,,,,,,CF_NIV_SUIV,,,CF_NIV_SUIV,,,,,,,,,CF_NIV_SUIV,,,,,,,,,,,CF_NIV_SUIV,True,,,,,CF_NIV_SUIV,[],CF_NIV_SUIV,2020-02-25 23:00:00,2020-04-01 22:00:00,CF_NIV_SUIV,,,,,Déclaration sans suite pour motif d'intérêt général
20-43316,CF_NIV_SUIV,CF_NIV_SUIV,20-39506,CF_NIV_SUIV,CF_NIV_SUIV,True,False,False,,,CF_NIV_SUIV,True,,,,False,,,,,,CF_NIV_SUIV,,,CF_NIV_SUIV,,,,,,,,,CF_NIV_SUIV,,,,,,,,,,,CF_NIV_SUIV,True,,,,,CF_NIV_SUIV,[],CF_NIV_SUIV,2020-03-15 23:00:00,2020-04-09 22:00:00,CF_NIV_SUIV,,,,,Un numéro d'engagement juridique erroné.
20-43396,CF_NIV_SUIV,CF_NIV_SUIV,20-38905,CF_NIV_SUIV,CF_NIV_SUIV,False,True,False,,,CF_NIV_SUIV,True,,,,False,,,,,,CF_NIV_SUIV,,,CF_NIV_SUIV,,,,,,,,,CF_NIV_SUIV,,,,,,,,,,,CF_NIV_SUIV,True,,,,,CF_NIV_SUIV,[],CF_NIV_SUIV,2020-03-12 23:00:00,2020-04-02 22:00:00,CF_NIV_SUIV,,,,,"Compte tenu de la crise liée au CORONAVIRUS, le président de la CCI Meuse Haute Marne a décidé, après concertation du 'groupe de travail Salon', de reporter le salon des savoir faire industriels de Haute-Marne à l'année prochaine, les vendredi 11 et samedi matin 12 juin 2021.Un nouvel avis de marché sera publié en 2021 pour l'organisation de ce futur salon"
19-191153,CF_NIV_SUIV,CF_NIV_SUIV,19-187003,CF_NIV_SUIV,CF_NIV_SUIV,True,False,False,,,CF_NIV_SUIV,True,,,,False,,,,,,CF_NIV_SUIV,,,CF_NIV_SUIV,,,,,,,,,CF_NIV_SUIV,,,,,,,,,,,CF_NIV_SUIV,True,,,,,CF_NIV_SUIV,[],CF_NIV_SUIV,2019-12-15 23:00:00,2020-02-13 23:00:00,CF_NIV_SUIV,,,,,La procédure est déclarée sans suite compte tenu de la nécessité pour le pouvoir adjudicateur de redéfinir son besoin.
20-43773,CF_NIV_SUIV,CF_NIV_SUIV,20-32966,CF_NIV_SUIV,CF_NIV_SUIV,False,True,False,,,CF_NIV_SUIV,True,,,,False,,,,,,CF_NIV_SUIV,,,CF_NIV_SUIV,,,,,,,,,CF_NIV_SUIV,,,,,,,,,,,CF_NIV_SUIV,True,,,,,CF_NIV_SUIV,[],CF_NIV_SUIV,2020-03-03 23:00:00,2020-05-13 22:00:00,CF_NIV_SUIV,,,,,Motif d'intérêt général - covid19
20-43799,CF_NIV_SUIV,CF_NIV_SUIV,20-39646,CF_NIV_SUIV,CF_NIV_SUIV,False,True,False,,,CF_NIV_SUIV,True,,,,False,,,,,,CF_NIV_SUIV,,,CF_NIV_SUIV,,,,,,,,,CF_NIV_SUIV,,,,,,,,,,,CF_NIV_SUIV,True,,,,,CF_NIV_SUIV,[],CF_NIV_SUIV,2020-03-15 23:00:00,2020-04-14 22:00:00,CF_NIV_SUIV,,,,,"Suite à la publication et à l'entrée vigueur du Décret no 2020-260 du 16 mars 2020 portant réglementation des déplacements dans le cadre de la lutte contre la propagation du virus covid-19, il a décidé par la Direction Générale de l'EPFIF, en application dudit décret, de mettre un terme aux visites de site. La présente consultation impliquant une telle visite, l'EPFIF y met un terme et procédera à une nouvelle consultation lorsque les conditions sanitaires le permettront.Merci de l'intérêt porté à cette consultation."
20-43931,CF_NIV_SUIV,CF_NIV_SUIV,20-34821,CF_NIV_SUIV,CF_NIV_SUIV,False,True,False,,,CF_NIV_SUIV,True,,,,False,,,,,,CF_NIV_SUIV,,,CF_NIV_SUIV,,,,,,,,,CF_NIV_SUIV,,,,,,,,,,,CF_NIV_SUIV,True,,,,,CF_NIV_SUIV,[],CF_NIV_SUIV,2020-03-05 23:00:00,2020-04-08 22:00:00,CF_NIV_SUIV,,,,,"Conformément aux dispositions de l'article R.2185-1 du Code de la Commande Publique, la procédure est déclarée sans suite, compte tenu du contexte de crise sanitaire actuel rendant notamment impossible les visites de site."
20-43952,CF_NIV_SUIV,CF_NIV_SUIV,20-38330,CF_NIV_SUIV,CF_NIV_SUIV,False,True,False,,,CF_NIV_SUIV,True,,,,False,,,,,,CF_NIV_SUIV,,,CF_NIV_SUIV,,,,,,,,,CF_NIV_SUIV,,,,,,,,,,,CF_NIV_SUIV,True,,,,,CF_NIV_SUIV,[],CF_NIV_SUIV,2020-03-12 23:00:00,2020-05-14 22:00:00,CF_NIV_SUIV,,,,,"Erreur dans la publication de l'avis d'attribution, il s'agit d'un avis d'attribution et non d'un avis de marché."
20-44340,CF_NIV_SUIV,CF_NIV_SUIV,20-34548,CF_NIV_SUIV,CF_NIV_SUIV,True,False,False,,,CF_NIV_SUIV,True,,,,False,,,,,,CF_NIV_SUIV,,,CF_NIV_SUIV,,,,,,,,,CF_NIV_SUIV,,,,,,,,,,,CF_NIV_SUIV,True,,,,,CF_NIV_SUIV,[],CF_NIV_SUIV,2020-03-05 23:00:00,2020-03-16 23:00:00,CF_NIV_SUIV,,,,,"Suite à l'épidemie de Coronavirus et aux mesures de confinement qui s'y rapportent et notamment l'interdiction de tout rassemblement, le thé dansant du 12 avril 2020 est annulé et reporté à une date ultérieure dès que la situation sanitaire le permettra."
20-44508,CF_NIV_SUIV,CF_NIV_SUIV,20-9784,CF_NIV_SUIV,CF_NIV_SUIV,False,True,False,,,CF_NIV_SUIV,True,,,,False,,,,,,CF_NIV_SUIV,,,CF_NIV_SUIV,,,,,,,,,CF_NIV_SUIV,,,,,,,,,,,CF_NIV_SUIV,True,,,,,CF_NIV_SUIV,[],CF_NIV_SUIV,2020-03-11 23:00:00,2020-04-09 22:00:00,CF_NIV_SUIV,,,,,"Déclaration sans suite pour motif d'intérêt général : au vu de l'état d'urgence sanitaire et des mesures de confinement liées à l'épidémie du covid-19, et les incertitudes qui impactent en conséquence la procédure de passation du marché public, il a été décide d'annuler cette consultation pour motif d'intérêt général.Selon les circonstances, cette consultation pourra être relancée ultérieurement."
20-44886,CF_NIV_SUIV,CF_NIV_SUIV,20-38617,CF_NIV_SUIV,CF_NIV_SUIV,False,True,False,,,CF_NIV_SUIV,True,,,,False,,,,,,CF_NIV_SUIV,,,CF_NIV_SUIV,,,,,,,,,CF_NIV_SUIV,,,,,,,,,,,CF_NIV_SUIV,True,,,,,CF_NIV_SUIV,[],CF_NIV_SUIV,2020-03-12 23:00:00,2020-04-13 22:00:00,CF_NIV_SUIV,,,,,"Décision en date du 23/03/2020 déclarant sans suite la procédure sur le fondement des articles R. 2185-1 et R. 2185-2 du code de la Commande publique, au motif que la crise sanitaire liée au 'Coronavirus' et les mesures de confinement prises par le gouvernement rendent incertaine la réalisation de la présente opération de travaux."
20-45019,CF_NIV_SUIV,CF_NIV_SUIV,20-38000,CF_NIV_SUIV,CF_NIV_SUIV,True,False,False,,,CF_NIV_SUIV,True,,,,False,,,,,,CF_NIV_SUIV,,,CF_NIV_SUIV,,,,,,,,,CF_NIV_SUIV,,,,,,,,,,,CF_NIV_SUIV,True,,,,,CF_NIV_SUIV,[],CF_NIV_SUIV,2020-03-11 23:00:00,2020-04-05 22:00:00,CF_NIV_SUIV,,,,,"En raison du contexte actuel et de l'impossibilité pour certains opérateurs de répondre à la consultation, celle-ci est annulée. Elle sera relancée après la période de confinement."
20-45023,CF_NIV_SUIV,CF_NIV_SUIV,20-34893,CF_NIV_SUIV,CF_NIV_SUIV,False,True,False,,,CF_NIV_SUIV,True,,,,False,,,,,,CF_NIV_SUIV,,,CF_NIV_SUIV,,,,,,,,,CF_NIV_SUIV,,,,,,,,,,,CF_NIV_SUIV,True,,,,,CF_NIV_SUIV,[],CF_NIV_SUIV,2020-03-05 23:00:00,2020-04-08 22:00:00,CF_NIV_SUIV,,,,,"Procédure classée sans suite pour motif d'intérêt général. la visite des locaux ne pouvant pas avoir lieu à la date choisie, les travaux ne pourront pas être effectués dans les temps impartis. les travaux sont reportés d'un an, la procédure sera relancée en temps utile"
20-45033,CF_NIV_SUIV,CF_NIV_SUIV,20-29476,CF_NIV_SUIV,CF_NIV_SUIV,False,True,False,,,CF_NIV_SUIV,True,,,,False,,,,,,CF_NIV_SUIV,,,CF_NIV_SUIV,,,,,,,,,CF_NIV_SUIV,,,,,,,,,,,CF_NIV_SUIV,True,,,,,CF_NIV_SUIV,[],CF_NIV_SUIV,2020-02-25 23:00:00,2020-03-30 22:00:00,CF_NIV_SUIV,,,,,"En raison de la crise sanitaire liées au Covid 19 rendant impossible les visites dans les EHPAD il a été décidé d'annuler la présente consultation. Une nouvelle consultation sera relancée, et les entreprises ayant retiré le DCE en seront informées"
20-45079,CF_NIV_SUIV,CF_NIV_SUIV,20-36827,CF_NIV_SUIV,CF_NIV_SUIV,True,False,False,,,CF_NIV_SUIV,True,,,,False,,,,,,CF_NIV_SUIV,,,CF_NIV_SUIV,,,,,,,,,CF_NIV_SUIV,,,,,,,,,,,CF_NIV_SUIV,True,,,,,CF_NIV_SUIV,[],CF_NIV_SUIV,2020-03-10 23:00:00,2020-03-31 22:00:00,CF_NIV_SUIV,,,,,"Compte tenu des circonstances actuelles de crise sanitaire et à la demande des candidats, un report de date de retour des offres initialement au 1er avril 2020 est reporté au 20 avril 2020.afin de permettre aux candidats de déposer leur offre après le 1er avril 2020, le marché à l'identique est enregistré et publié sous le N°20007MAR00"
20-45441,CF_NIV_SUIV,CF_NIV_SUIV,20-37430,CF_NIV_SUIV,CF_NIV_SUIV,True,False,False,,,CF_NIV_SUIV,True,,,,False,,,,,,CF_NIV_SUIV,,,CF_NIV_SUIV,,,,,,,,,CF_NIV_SUIV,,,,,,,,,,,CF_NIV_SUIV,True,,,,,CF_NIV_SUIV,[],CF_NIV_SUIV,2020-03-10 23:00:00,2020-03-18 23:00:00,CF_NIV_SUIV,,,,,Motif d'intérêt général lié au contexte national de confinement empêchant la mise en oeuvre des principes fondamentaux de la commande publique
20-45577,CF_NIV_SUIV,CF_NIV_SUIV,20-34336,CF_NIV_SUIV,CF_NIV_SUIV,False,True,False,,,CF_NIV_SUIV,True,,,,False,,,,,,CF_NIV_SUIV,,,CF_NIV_SUIV,,,,,,,,,CF_NIV_SUIV,,,,,,,,,,,CF_NIV_SUIV,True,,,,,CF_NIV_SUIV,[],CF_NIV_SUIV,2020-03-05 23:00:00,2020-04-06 22:00:00,CF_NIV_SUIV,,,,,"Au regard du planning d'exécution des travaux et du contexte actuel lié au Covid-19, la présente consultation est déclarée sans suite et est reportée à une date ultérieure."
20-45654,CF_NIV_SUIV,CF_NIV_SUIV,20-34413,CF_NIV_SUIV,CF_NIV_SUIV,False,True,False,,,CF_NIV_SUIV,True,,,,False,,,,,,CF_NIV_SUIV,,,CF_NIV_SUIV,,,,,,,,,CF_NIV_SUIV,,,,,,,,,,,CF_NIV_SUIV,True,,,,,CF_NIV_SUIV,[],CF_NIV_SUIV,2020-03-05 23:00:00,2020-04-15 22:00:00,CF_NIV_SUIV,,,,,"Impossibilité pour les entreprises à répondre à l'appel d'offres à la date fixée compte tenu du confinement, impossibilité du maître d'ouvrage d'attribuer les travaux en raison du report du 2nd tour des élections municipales et impératif de réaliser les travaux entre le 1er juin et le 30 septembre pour éviter les crues.Une nouvelle consultation sera engagée avant fin 2020 pour une réalisation des travaux en 2021."
20-45805,CF_NIV_SUIV,CF_NIV_SUIV,20-31756,CF_NIV_SUIV,CF_NIV_SUIV,False,True,False,,,CF_NIV_SUIV,True,,,,False,,,,,,CF_NIV_SUIV,,,CF_NIV_SUIV,,,,,,,,,CF_NIV_SUIV,,,,,,,,,,,CF_NIV_SUIV,True,,,,,CF_NIV_SUIV,[],CF_NIV_SUIV,2020-03-01 23:00:00,2020-03-19 23:00:00,CF_NIV_SUIV,,,,,"A la suite de la redéfinition du besoin par la Direction des systèmes d'information de la Caisse Nationale d'Assurance Vieillesse (ci-après dénommée la Cnav), la spécificité liée à l'environnement SGBD PostgreSQL ne semble plus pertinente. Le marché public de la Cnav s'agissant des "" prestations de suivi et support de logiciels de type Open source et prestations associées "" suffit à répondre aux besoins de la Direction à ce jour. Alors, je suis au regret de vous informer que la procédure citée en objet est déclarée sans suite au motif de la disparition du besoin à l'origine de cette procédure.Vous disposez d'un délai de deux mois à compter de la notification de la présente décision pour saisir le Tribunal administratif de Paris d'un recours contre cette décision."
20-45878,CF_NIV_SUIV,CF_NIV_SUIV,20-36167,CF_NIV_SUIV,CF_NIV_SUIV,False,True,False,,,CF_NIV_SUIV,True,,,,False,,,,,,CF_NIV_SUIV,,,CF_NIV_SUIV,,,,,,,,,CF_NIV_SUIV,,,,,,,,,,,CF_NIV_SUIV,True,,,,,CF_NIV_SUIV,[],CF_NIV_SUIV,2020-03-09 23:00:00,2020-04-09 22:00:00,CF_NIV_SUIV,,,,,"A la suite des mesures gouvernementales liées au Covid-19, la présente consultation est déclarée sans suite."
20-46338,CF_NIV_SUIV,CF_NIV_SUIV,20-45939,CF_NIV_SUIV,CF_NIV_SUIV,False,True,False,,,CF_NIV_SUIV,True,,,,False,,,,,,CF_NIV_SUIV,,,CF_NIV_SUIV,,,,,,,,,CF_NIV_SUIV,,,,,,,,,,,CF_NIV_SUIV,True,,,,,CF_NIV_SUIV,[],CF_NIV_SUIV,2020-03-26 23:00:00,2020-06-08 22:00:00,CF_NIV_SUIV,,,,,Report sine die de la consultation
20-46373,CF_NIV_SUIV,CF_NIV_SUIV,20-36538,CF_NIV_SUIV,CF_NIV_SUIV,False,True,False,,,CF_NIV_SUIV,True,,,,False,,,,,,CF_NIV_SUIV,,,CF_NIV_SUIV,,,,,,,,,CF_NIV_SUIV,,,,,,,,,,,CF_NIV_SUIV,True,,,,,CF_NIV_SUIV,[],CF_NIV_SUIV,2020-03-09 23:00:00,2020-04-02 22:00:00,CF_NIV_SUIV,,,,,"En raison de la crise sanitaire actuelle et conformément à l'article 5 du règlement de la consultation qui stipule : "" Conformément à l'article R 2185-1 du Code De La Commande Publique, le pouvoir adjudicateur peut à tout moment mettre fin à la procédure et la déclarer sans suite pour des motifs d'intérêt général. "", nous vous informons que nous annulons cette procédure."
20-47064,CF_NIV_SUIV,CF_NIV_SUIV,20-37122,CF_NIV_SUIV,CF_NIV_SUIV,False,True,False,,,CF_NIV_SUIV,True,,,,False,,,,,,CF_NIV_SUIV,,,CF_NIV_SUIV,,,,,,,,,CF_NIV_SUIV,,,,,,,,,,,CF_NIV_SUIV,True,,,,,CF_NIV_SUIV,[],CF_NIV_SUIV,2020-03-10 23:00:00,2020-04-09 22:00:00,CF_NIV_SUIV,,,,,"Compte tenu de l'épidémie de COVID-19 et des mesures de confinement qui ont été mises en place, les délais de remise des offres mais aussi d'exécution des travaux ne pourront être respectés. Dans cette perspective, le planning de l'opération et le phasage des travaux doivent être revus en concertation avec la maitrise d'oeuvre. Ainsi, une consultation similaire tenant compte d'un calendrier différent sera très prochainement publiée."
