BOAMP_AVIS_NUM,D_10_01_Annulation_Annulinfoannonceanterieur,D_10_01_01_Annulation_Annulinfoannonceanterieur_Reference,D_10_01_01_01_Annulation_Annulinfoannonceanterieur_Reference_Idweb,D_10_01_01_02_Annulation_Annulinfoannonceanterieur_Reference_Typeavis,D_10_01_01_02_01_Annulation_Annulinfoannonceanterieur_Reference_Typeavis_Famille,D_10_01_01_02_01_01_Annulation_Annulinfoannonceanterieur_Reference_Typeavis_Famille_Mapa,D_10_01_01_02_01_02_Annulation_Annulinfoannonceanterieur_Reference_Typeavis_Famille_Fns,D_10_01_01_02_01_03_Annulation_Annulinfoannonceanterieur_Reference_Typeavis_Famille_Joue,D_10_01_01_02_01_04_Annulation_Annulinfoannonceanterieur_Reference_Typeavis_Famille_Dsp,D_10_01_01_02_01_05_Annulation_Annulinfoannonceanterieur_Reference_Typeavis_Famille_Divers,D_10_01_01_02_02_Annulation_Annulinfoannonceanterieur_Reference_Typeavis_Perimetre,D_10_01_01_02_02_01_Annulation_Annulinfoannonceanterieur_Reference_Typeavis_Perimetre_Cmp2006,D_10_01_01_02_02_02_Annulation_Annulinfoannonceanterieur_Reference_Typeavis_Perimetre_Cmp2006DEFENSE,D_10_01_01_02_02_03_Annulation_Annulinfoannonceanterieur_Reference_Typeavis_Perimetre_Directive18,D_10_01_01_02_02_04_Annulation_Annulinfoannonceanterieur_Reference_Typeavis_Perimetre_Directive17,D_10_01_01_02_02_05_Annulation_Annulinfoannonceanterieur_Reference_Typeavis_Perimetre_Directive81,D_10_01_01_02_02_06_Annulation_Annulinfoannonceanterieur_Reference_Typeavis_Perimetre_Directive23,D_10_01_01_02_02_07_Annulation_Annulinfoannonceanterieur_Reference_Typeavis_Perimetre_Directive24,D_10_01_01_02_02_08_Annulation_Annulinfoannonceanterieur_Reference_Typeavis_Perimetre_Directive25,D_10_01_01_02_02_09_Annulation_Annulinfoannonceanterieur_Reference_Typeavis_Perimetre_Dsp,D_10_01_01_02_02_10_Annulation_Annulinfoannonceanterieur_Reference_Typeavis_Perimetre_Autre,D_10_01_01_02_03_Annulation_Annulinfoannonceanterieur_Reference_Typeavis_Nature,D_10_01_01_02_03_01_Annulation_Annulinfoannonceanterieur_Reference_Typeavis_Nature_Preinformation,D_10_01_01_02_03_02_Annulation_Annulinfoannonceanterieur_Reference_Typeavis_Nature_Profilacheteur,D_10_01_01_02_03_03_Annulation_Annulinfoannonceanterieur_Reference_Typeavis_Nature_Appeloffre,D_10_01_01_02_03_03_01_Annulation_Annulinfoannonceanterieur_Reference_Typeavis_Nature_Appeloffre_Standard,D_10_01_01_02_03_03_02_Annulation_Annulinfoannonceanterieur_Reference_Typeavis_Nature_Appeloffre_Concours,D_10_01_01_02_03_03_03_Annulation_Annulinfoannonceanterieur_Reference_Typeavis_Nature_Appeloffre_Periodique,D_10_01_01_02_03_03_04_Annulation_Annulinfoannonceanterieur_Reference_Typeavis_Nature_Appeloffre_Qualification,D_10_01_01_02_03_03_05_Annulation_Annulinfoannonceanterieur_Reference_Typeavis_Nature_Appeloffre_Sad,D_10_01_01_02_03_03_06_Annulation_Annulinfoannonceanterieur_Reference_Typeavis_Nature_Appeloffre_Concession,D_10_01_01_02_03_03_07_Annulation_Annulinfoannonceanterieur_Reference_Typeavis_Nature_Appeloffre_Concessionnaire,D_10_01_01_02_03_04_Annulation_Annulinfoannonceanterieur_Reference_Typeavis_Nature_Intentionconclure,D_10_01_01_02_03_05_Annulation_Annulinfoannonceanterieur_Reference_Typeavis_Nature_Attribution,D_10_01_01_02_03_05_01_Annulation_Annulinfoannonceanterieur_Reference_Typeavis_Nature_Attribution_Standard,D_10_01_01_02_03_05_02_Annulation_Annulinfoannonceanterieur_Reference_Typeavis_Nature_Attribution_Concours,D_10_01_01_02_03_05_03_Annulation_Annulinfoannonceanterieur_Reference_Typeavis_Nature_Attribution_Concession,D_10_01_01_02_03_05_04_Annulation_Annulinfoannonceanterieur_Reference_Typeavis_Nature_Attribution_Standardinfructueuxsanssuite,D_10_01_01_02_03_06_Annulation_Annulinfoannonceanterieur_Reference_Typeavis_Nature_Soustraitance,D_10_01_01_02_03_07_Annulation_Annulinfoannonceanterieur_Reference_Typeavis_Nature_Modification,D_10_01_01_02_03_08_Annulation_Annulinfoannonceanterieur_Reference_Typeavis_Nature_Qualification,D_10_01_01_02_03_09_Annulation_Annulinfoannonceanterieur_Reference_Typeavis_Nature_Rectificatif,D_10_01_01_02_03_10_Annulation_Annulinfoannonceanterieur_Reference_Typeavis_Nature_Periodique,D_10_01_01_02_03_11_Annulation_Annulinfoannonceanterieur_Reference_Typeavis_Nature_Autre,D_10_01_01_02_04_Annulation_Annulinfoannonceanterieur_Reference_Typeavis_Statut,D_10_01_01_02_04_01_Annulation_Annulinfoannonceanterieur_Reference_Typeavis_Statut_Initial,D_10_01_01_02_04_02_Annulation_Annulinfoannonceanterieur_Reference_Typeavis_Statut_Rectificatif,D_10_01_01_02_04_03_Annulation_Annulinfoannonceanterieur_Reference_Typeavis_Statut_Annulation,D_10_01_01_02_04_04_Annulation_Annulinfoannonceanterieur_Reference_Typeavis_Statut_Modification,D_10_01_01_03_Annulation_Annulinfoannonceanterieur_Reference_Dateenvoi,D_10_01_02_Annulation_Annulinfoannonceanterieur_Referencepublication,D_10_01_02_01_Annulation_Annulinfoannonceanterieur_Referencepublication_Publicationpapier,D_10_01_02_02_Annulation_Annulinfoannonceanterieur_Referencepublication_Publicationelectronique,D_10_01_02_02_01_Annulation_Annulinfoannonceanterieur_Referencepublication_Publicationelectronique_Datepublication,D_10_01_02_02_02_Annulation_Annulinfoannonceanterieur_Referencepublication_Publicationelectronique_Datefindiffusion,D_10_01_02_03_Annulation_Annulinfoannonceanterieur_Referencepublication_Publicationjoue,D_10_01_02_03_01_Annulation_Annulinfoannonceanterieur_Referencepublication_Publicationjoue_Annee,D_10_01_02_03_02_Annulation_Annulinfoannonceanterieur_Referencepublication_Publicationjoue_Numparution,D_10_01_02_03_03_Annulation_Annulinfoannonceanterieur_Referencepublication_Publicationjoue_Numannonce,D_10_01_02_03_04_Annulation_Annulinfoannonceanterieur_Referencepublication_Publicationjoue_Datepublication,D_10_02_Annulation_Motif
20-32058,CF_NIV_SUIV,CF_NIV_SUIV,20-31652,CF_NIV_SUIV,CF_NIV_SUIV,False,True,False,,,CF_NIV_SUIV,True,,,,False,,,,,,CF_NIV_SUIV,,,CF_NIV_SUIV,,,,,,,,,CF_NIV_SUIV,,,,,,,,,,,CF_NIV_SUIV,True,,,,,CF_NIV_SUIV,[],CF_NIV_SUIV,2020-03-01 23:00:00,2020-03-18 23:00:00,CF_NIV_SUIV,,,,,Modification des minimum et maximum.
20-32420,CF_NIV_SUIV,CF_NIV_SUIV,20-32027,CF_NIV_SUIV,CF_NIV_SUIV,False,True,False,,,CF_NIV_SUIV,True,,,,False,,,,,,CF_NIV_SUIV,,,CF_NIV_SUIV,,,,,,,,,CF_NIV_SUIV,,,,,,,,,,,CF_NIV_SUIV,True,,,,,CF_NIV_SUIV,[],CF_NIV_SUIV,2020-03-02 23:00:00,2020-04-05 22:00:00,CF_NIV_SUIV,,,,,"Les besoins de l'opération ayant changés, la consultation est annulée pour motif d'intérêt général."
20-32749,CF_NIV_SUIV,CF_NIV_SUIV,20-28618,CF_NIV_SUIV,CF_NIV_SUIV,False,True,False,,,CF_NIV_SUIV,True,,,,False,,,,,,CF_NIV_SUIV,,,CF_NIV_SUIV,,,,,,,,,CF_NIV_SUIV,,,,,,,,,,,CF_NIV_SUIV,True,,,,,CF_NIV_SUIV,[],CF_NIV_SUIV,2020-02-24 23:00:00,2020-03-07 23:00:00,CF_NIV_SUIV,,,,,Doublon avec l'annonce no 20-28679
20-33478,CF_NIV_SUIV,CF_NIV_SUIV,20-23474,CF_NIV_SUIV,CF_NIV_SUIV,False,True,False,,,CF_NIV_SUIV,True,,,,False,,,,,,CF_NIV_SUIV,,,CF_NIV_SUIV,,,,,,,,,CF_NIV_SUIV,,,,,,,,,,,CF_NIV_SUIV,True,,,,,CF_NIV_SUIV,[],CF_NIV_SUIV,2020-02-13 23:00:00,2020-03-08 23:00:00,CF_NIV_SUIV,,,,,La présente consultation est déclarée sans suite par l'Acheteur pour le motif suivant : disparution du besoin
20-33737,CF_NIV_SUIV,CF_NIV_SUIV,20-19974,CF_NIV_SUIV,CF_NIV_SUIV,False,True,False,,,CF_NIV_SUIV,True,,,,False,,,,,,CF_NIV_SUIV,,,CF_NIV_SUIV,,,,,,,,,CF_NIV_SUIV,,,,,,,,,,,CF_NIV_SUIV,True,,,,,CF_NIV_SUIV,[],CF_NIV_SUIV,2020-02-06 23:00:00,2020-03-01 23:00:00,CF_NIV_SUIV,,,,,Aucun pli parvenu en réponse à la consultation. Une seconde procédure est relancée prochainement.
20-33881,CF_NIV_SUIV,CF_NIV_SUIV,19-174287,CF_NIV_SUIV,CF_NIV_SUIV,False,True,False,,,CF_NIV_SUIV,True,,,,False,,,,,,CF_NIV_SUIV,,,CF_NIV_SUIV,,,,,,,,,CF_NIV_SUIV,,,,,,,,,,,CF_NIV_SUIV,True,,,,,CF_NIV_SUIV,[],CF_NIV_SUIV,2019-11-19 23:00:00,2019-12-19 23:00:00,CF_NIV_SUIV,,,,,Le marché est déclaré sans suite au motif que le projet n'est pas viable économiquement
20-34737,CF_NIV_SUIV,CF_NIV_SUIV,19-153209,CF_NIV_SUIV,CF_NIV_SUIV,True,False,False,,,CF_NIV_SUIV,True,,,,False,,,,,,CF_NIV_SUIV,,,CF_NIV_SUIV,,,,,,,,,CF_NIV_SUIV,,,,,,,,,,,CF_NIV_SUIV,True,,,,,CF_NIV_SUIV,[],CF_NIV_SUIV,2020-02-12 23:00:00,2020-03-22 23:00:00,CF_NIV_SUIV,,,,,"Des modifications substantielles du programme des travaux impacte la consultation de Maîtrise d'oeuvre pour la réfection partielle de la couverture et des menuiseries du groupe scolaire JEAN ROSTAND à Angers et nécessite de déclarer celle-ci sans suite pour motif d'intérêt général.Des renseignements sur l'introduction des recours peuvent être obtenus à l'adresse suivante : Tribunal administratif de Nantes: 6 allée des Gloriettes, 44041 NANTES CEDEX - courriel : greffe.ta-nantes@juradm.fr; adresse internet: http://www.nantes.tribunal-administratif.fr"
20-35947,CF_NIV_SUIV,CF_NIV_SUIV,20-21871,CF_NIV_SUIV,CF_NIV_SUIV,True,False,False,,,CF_NIV_SUIV,True,,,,False,,,,,,CF_NIV_SUIV,,,CF_NIV_SUIV,,,,,,,,,CF_NIV_SUIV,,,,,,,,,,,CF_NIV_SUIV,True,,,,,CF_NIV_SUIV,[],CF_NIV_SUIV,2020-02-11 23:00:00,2020-03-12 23:00:00,CF_NIV_SUIV,,,,,Modification des cahiers des clauses administratives et techniques particulières
20-36305,CF_NIV_SUIV,CF_NIV_SUIV,19-105280,CF_NIV_SUIV,CF_NIV_SUIV,False,True,False,,,CF_NIV_SUIV,True,,,,False,,,,,,CF_NIV_SUIV,,,CF_NIV_SUIV,,,,,,,,,CF_NIV_SUIV,,,,,,,,,,,CF_NIV_SUIV,True,,,,,CF_NIV_SUIV,[],CF_NIV_SUIV,2019-07-07 22:00:00,2019-07-29 22:00:00,CF_NIV_SUIV,,,,,Le Directeur Général de la RTM a décidé de ne pas donner suite à la procédure visée en objet pour motif d'intérêt général.
20-38699,CF_NIV_SUIV,CF_NIV_SUIV,19-192032,CF_NIV_SUIV,CF_NIV_SUIV,False,True,False,,,CF_NIV_SUIV,True,,,,False,,,,,,CF_NIV_SUIV,,,CF_NIV_SUIV,,,,,,,,,CF_NIV_SUIV,,,,,,,,,,,CF_NIV_SUIV,True,,,,,CF_NIV_SUIV,[],CF_NIV_SUIV,2019-12-25 23:00:00,2020-01-14 23:00:00,CF_NIV_SUIV,,,,,"La procédure est déclarée infructueuse pour le motif suivant : réception d'une seule offre, irrégulière.Le besoin va être redéfini et une nouvelle procédure va être engagée."
20-39040,CF_NIV_SUIV,CF_NIV_SUIV,20-33629,CF_NIV_SUIV,CF_NIV_SUIV,False,True,False,,,CF_NIV_SUIV,True,,,,False,,,,,,CF_NIV_SUIV,,,CF_NIV_SUIV,,,,,,,,,CF_NIV_SUIV,,,,,,,,,,,CF_NIV_SUIV,True,,,,,CF_NIV_SUIV,[],CF_NIV_SUIV,2020-03-04 23:00:00,2020-04-06 22:00:00,CF_NIV_SUIV,,,,,"En raison du contexte sanitaire, les visites de locaux ne peuvent avoir lieu.Pour cette raison la présente consultation est annulée; elle sera relancée ultérieurement"
20-39234,CF_NIV_SUIV,CF_NIV_SUIV,19-176524,CF_NIV_SUIV,CF_NIV_SUIV,False,True,False,,,CF_NIV_SUIV,True,,,,False,,,,,,CF_NIV_SUIV,,,CF_NIV_SUIV,,,,,,,,,CF_NIV_SUIV,,,,,,,,,,,CF_NIV_SUIV,True,,,,,CF_NIV_SUIV,[],CF_NIV_SUIV,2019-11-24 23:00:00,2020-01-09 23:00:00,CF_NIV_SUIV,,,,,"La procédure noAMU76-2019 a été déclarée sans suite pour le motif suivant :Redéfinition du besoin de la personne publique : En effet, suite aux élections et à la mise en place de la nouvelle gouvernance d'Aix-Marseille Université, le besoin d'un mandataire sécurité pour les IGH des campus Timone et Saint-Charles n'est plus nécessaire au regard de la domiciliation du Président d'Aix-Marseille Université sur la commune de Marseille.En conséquence :-Les besoins exprimés ne correspondent plus à l'attente du pouvoir adjudicateur.-Aix-Marseille Université ne peut plus remplir son obligation contractuelle de commande minimum correspondant à la passation des deux premiers marchés subséquents pour les IGH Timone et Saint-Charles, conformément à ce qui était prévu à l'article 2.2.1 du CCAP. Les candidats ont été informés.Une nouvelle consultation sera relancée pour le besoin relatif à l'IGH du campus de Luminy."
20-39237,CF_NIV_SUIV,CF_NIV_SUIV,20-37668,CF_NIV_SUIV,CF_NIV_SUIV,False,True,False,,,CF_NIV_SUIV,True,,,,False,,,,,,CF_NIV_SUIV,,,CF_NIV_SUIV,,,,,,,,,CF_NIV_SUIV,,,,,,,,,,,CF_NIV_SUIV,True,,,,,CF_NIV_SUIV,[],CF_NIV_SUIV,2020-03-11 23:00:00,2020-04-19 22:00:00,CF_NIV_SUIV,,,,,"Compte tenu de la situation sanitaire en France, les écoles et autres lieux recevant du public sont fermés par arrêtés des 14 et 15 mars 2020 portant diverses mesures relatives à la lutte contre la propagation du virus covid-19. Il s'ensuit que la visite obligatoire des cuisines prévue le 31 mars 2020 ne pourra avoir lieu. En conséquence, le présent avis d'appel public à concurrence est annulé."
20-39267,CF_NIV_SUIV,CF_NIV_SUIV,20-19609,CF_NIV_SUIV,CF_NIV_SUIV,False,True,False,,,CF_NIV_SUIV,True,,,,False,,,,,,CF_NIV_SUIV,,,CF_NIV_SUIV,,,,,,,,,CF_NIV_SUIV,,,,,,,,,,,CF_NIV_SUIV,True,,,,,CF_NIV_SUIV,[],CF_NIV_SUIV,2020-02-06 23:00:00,2020-03-17 23:00:00,CF_NIV_SUIV,,,,,"Compte tenu de l'actualité sanitaire (CORONAVIRUS), il est impossible de faire pénétrer les entreprises de travaux dans les bâtiments d'hébergement"
20-39290,CF_NIV_SUIV,CF_NIV_SUIV,20-32521,CF_NIV_SUIV,CF_NIV_SUIV,False,True,False,,,CF_NIV_SUIV,True,,,,False,,,,,,CF_NIV_SUIV,,,CF_NIV_SUIV,,,,,,,,,CF_NIV_SUIV,,,,,,,,,,,CF_NIV_SUIV,True,,,,,CF_NIV_SUIV,[],CF_NIV_SUIV,2020-03-02 23:00:00,2020-04-02 22:00:00,CF_NIV_SUIV,,,,,"Le marché est annulé en raison de la pandémie, en effet les visites Prévues ne peuvent plus être maintenues pour répondre au marché, il sera relancé en temps voulu."
20-39544,CF_NIV_SUIV,CF_NIV_SUIV,20-21348,CF_NIV_SUIV,CF_NIV_SUIV,False,True,False,,,CF_NIV_SUIV,True,,,,False,,,,,,CF_NIV_SUIV,,,CF_NIV_SUIV,,,,,,,,,CF_NIV_SUIV,,,,,,,,,,,CF_NIV_SUIV,True,,,,,CF_NIV_SUIV,[],CF_NIV_SUIV,2020-02-10 23:00:00,2020-03-05 23:00:00,CF_NIV_SUIV,,,,,En raison de la crise sanitaire Caux Seine agglo a décidé d'arrêter la procédure engagée
20-39588,CF_NIV_SUIV,CF_NIV_SUIV,20-29398,CF_NIV_SUIV,CF_NIV_SUIV,False,True,False,,,CF_NIV_SUIV,True,,,,False,,,,,,CF_NIV_SUIV,,,CF_NIV_SUIV,,,,,,,,,CF_NIV_SUIV,,,,,,,,,,,CF_NIV_SUIV,True,,,,,CF_NIV_SUIV,[],CF_NIV_SUIV,2020-02-25 23:00:00,2020-03-24 23:00:00,CF_NIV_SUIV,,,,,Annulation de la consultation en raison d'une alerte sanitaire
20-39779,CF_NIV_SUIV,CF_NIV_SUIV,20-27533,CF_NIV_SUIV,CF_NIV_SUIV,True,False,False,,,CF_NIV_SUIV,True,,,,False,,,,,,CF_NIV_SUIV,,,CF_NIV_SUIV,,,,,,,,,CF_NIV_SUIV,,,,,,,,,,,CF_NIV_SUIV,True,,,,,CF_NIV_SUIV,[],CF_NIV_SUIV,2020-02-20 23:00:00,2020-03-23 23:00:00,CF_NIV_SUIV,,,,,"Compte tenu de la situation actuelle en France, la présente procédure est annulée"
20-39970,CF_NIV_SUIV,CF_NIV_SUIV,20-30817,CF_NIV_SUIV,CF_NIV_SUIV,False,True,False,,,CF_NIV_SUIV,True,,,,False,,,,,,CF_NIV_SUIV,,,CF_NIV_SUIV,,,,,,,,,CF_NIV_SUIV,,,,,,,,,,,CF_NIV_SUIV,True,,,,,CF_NIV_SUIV,[],CF_NIV_SUIV,2020-02-27 23:00:00,2020-04-27 22:00:00,CF_NIV_SUIV,,,,,"Conformément aux dispositions de Code de la commande publique et notamment son article R.2185-1, la Communauté de Communes du Pays de Sainte Odile a décidé d'abandonner la procédure d'attribution du marché public pour les travaux de remplacement et d'entretien des faux plafonds de l'Espace Aquatique L'O à Obernai, pour motif d'intérêt général.En effet, les circonstances exceptionnelles qui affectent notre pays et les mesures de confinement issue du Gouvernement ne permettent pas la poursuite de la procédure d'attribution du marché public précité dans des conditions favorables, notamment en ce qui concerne les visites sur site obligatoires."
20-39998,CF_NIV_SUIV,CF_NIV_SUIV,20-37174,CF_NIV_SUIV,CF_NIV_SUIV,False,True,False,,,CF_NIV_SUIV,True,,,,False,,,,,,CF_NIV_SUIV,,,CF_NIV_SUIV,,,,,,,,,CF_NIV_SUIV,,,,,,,,,,,CF_NIV_SUIV,True,,,,,CF_NIV_SUIV,[],CF_NIV_SUIV,2020-03-10 23:00:00,2020-04-06 22:00:00,CF_NIV_SUIV,,,,,"Au vu des évènements liés à la crise sanitaire que connaît notre pays, nous vous informons que la présente procédure est annulée pour motif d'intérêt général et sera relancée ultérieurement."
20-40131,CF_NIV_SUIV,CF_NIV_SUIV,20-30189,CF_NIV_SUIV,CF_NIV_SUIV,True,False,False,,,CF_NIV_SUIV,True,,,,False,,,,,,CF_NIV_SUIV,,,CF_NIV_SUIV,,,,,,,,,CF_NIV_SUIV,,,,,,,,,,,CF_NIV_SUIV,True,,,,,CF_NIV_SUIV,[],CF_NIV_SUIV,2020-02-26 23:00:00,2020-03-24 23:00:00,CF_NIV_SUIV,,,,,En raison de la crise sanitaire et des difficultés de programmation des visites obligatoires la consultation est annulée et sera relancée ultérieurement
20-40195,CF_NIV_SUIV,CF_NIV_SUIV,20-37679,CF_NIV_SUIV,CF_NIV_SUIV,False,True,False,,,CF_NIV_SUIV,True,,,,False,,,,,,CF_NIV_SUIV,,,CF_NIV_SUIV,,,,,,,,,CF_NIV_SUIV,,,,,,,,,,,CF_NIV_SUIV,True,,,,,CF_NIV_SUIV,[],CF_NIV_SUIV,2020-03-11 23:00:00,2020-04-06 22:00:00,CF_NIV_SUIV,,,,,"En raison du COVID 19, il a été décidé d'annuler la consultation portant sur la 'restauration du clos et du couvert et mise en sécurité des abords de la maison de P. Loti.Cette consultation sera relancée ultérieurement.Bien cordialement"
20-40350,CF_NIV_SUIV,CF_NIV_SUIV,20-31767,CF_NIV_SUIV,CF_NIV_SUIV,False,True,False,,,CF_NIV_SUIV,True,,,,False,,,,,,CF_NIV_SUIV,,,CF_NIV_SUIV,,,,,,,,,CF_NIV_SUIV,,,,,,,,,,,CF_NIV_SUIV,True,,,,,CF_NIV_SUIV,[],CF_NIV_SUIV,2020-03-01 23:00:00,2020-04-02 22:00:00,CF_NIV_SUIV,,,,,"compte tenu des mesures de confinement imposées par le gouvernement, la présente consultation est reportée à une date ultérieure"
20-40545,CF_NIV_SUIV,CF_NIV_SUIV,20-31470,CF_NIV_SUIV,CF_NIV_SUIV,False,True,False,,,CF_NIV_SUIV,True,,,,False,,,,,,CF_NIV_SUIV,,,CF_NIV_SUIV,,,,,,,,,CF_NIV_SUIV,,,,,,,,,,,CF_NIV_SUIV,True,,,,,CF_NIV_SUIV,[],CF_NIV_SUIV,2020-03-01 23:00:00,2020-03-24 23:00:00,CF_NIV_SUIV,,,,,"Compte tenu des conditions exceptionnelles que nous impose la crise du COVID-19, nous stoppons toutes démarches concernant cette procédure qui sera reprise à une date ultérieure non définie a ce jour"
20-40614,CF_NIV_SUIV,CF_NIV_SUIV,20-35163,CF_NIV_SUIV,CF_NIV_SUIV,False,True,False,,,CF_NIV_SUIV,True,,,,False,,,,,,CF_NIV_SUIV,,,CF_NIV_SUIV,,,,,,,,,CF_NIV_SUIV,,,,,,,,,,,CF_NIV_SUIV,True,,,,,CF_NIV_SUIV,[],CF_NIV_SUIV,2020-03-08 23:00:00,2020-03-26 23:00:00,CF_NIV_SUIV,,,,,"Le motif d'annulation de procédure est un cas de force majeur, pour raisons sanitaires liées au COVID-19 en France.Nous ne pouvons effectuer la deuxième visite obligatoire, ce qui risquerait d'engendrer une iniquité de traitement des candidats. La procédure se terminant le 27 mars, une visite supplémentaire ne peut être effectuée et le règlement de consultation modifié, dans le temps imparti de la procédure. Une nouvelle procédure complète sera relancée dès que possible, dans les même termes."
20-40625,CF_NIV_SUIV,CF_NIV_SUIV,20-32704,CF_NIV_SUIV,CF_NIV_SUIV,False,True,False,,,CF_NIV_SUIV,True,,,,False,,,,,,CF_NIV_SUIV,,,CF_NIV_SUIV,,,,,,,,,CF_NIV_SUIV,,,,,,,,,,,CF_NIV_SUIV,True,,,,,CF_NIV_SUIV,[],CF_NIV_SUIV,2020-03-03 23:00:00,2020-03-26 23:00:00,CF_NIV_SUIV,,,,,Au vu des mesures gouvernementales prises par le Président de la République concernant le covid 19 ainsi que de l'impossibilité de maintenir la date de visite prévue à l'art 7.4 du Règlement de consultation.La consultation sera relancée dès que les circonstances le permettront.
20-40628,CF_NIV_SUIV,CF_NIV_SUIV,20-38594,CF_NIV_SUIV,CF_NIV_SUIV,False,True,False,,,CF_NIV_SUIV,True,,,,False,,,,,,CF_NIV_SUIV,,,CF_NIV_SUIV,,,,,,,,,CF_NIV_SUIV,,,,,,,,,,,CF_NIV_SUIV,True,,,,,CF_NIV_SUIV,[],CF_NIV_SUIV,2020-03-12 23:00:00,2020-04-24 22:00:00,CF_NIV_SUIV,,,,,"Compte tenu des dernières informations et consignes concernant le COVID-19, le pouvoir adjudicateur décide l'abandon de la consultation : Exécution de travaux de terrassements, voirie, réseaux divers, espaces verts et essais nécessaires à la viabilisation de la ZAC ' MEZEIRAC ' sur la commune de Marguerittes (30320).Les conditions de finalisation des offres étant fortement perturbées, et n'ayant nous même pas de visibilité sur une date de report de remise des offres raisonnable, nous préférons abandonner cette procédure afin d'éviter les risques tenant aux incertitudes qui peuvent affectées la consultation.Nous relancerons une nouvelle procédure dès que possible sur cette même plateforme. Comptant sur votre compréhension, nous vous invitons à rester en alerte pour vous tenir au courant de la nouvelle publication."
20-40659,CF_NIV_SUIV,CF_NIV_SUIV,20-29911,CF_NIV_SUIV,CF_NIV_SUIV,False,True,False,,,CF_NIV_SUIV,True,,,,False,,,,,,CF_NIV_SUIV,,,CF_NIV_SUIV,,,,,,,,,CF_NIV_SUIV,,,,,,,,,,,CF_NIV_SUIV,True,,,,,CF_NIV_SUIV,[],CF_NIV_SUIV,2020-02-26 23:00:00,2020-03-26 23:00:00,CF_NIV_SUIV,,,,,"En raison des risques sanitaires en cours, la Chambre de Métiers et de L'Artisanat de la Moselle est dans l'incapacité de garantir l'iniquité de traitement des candidats pour cette procédure (impossibilité d'assurer la seconde visite obligatoire du jeudi 19 mars 2020 à 14h00 - ANNULEE). De ce fait, la présente procédure est annulée. Une nouvelle procédure sera relancée, dans les mêmes termes, dès que possible."
20-40667,CF_NIV_SUIV,CF_NIV_SUIV,20-37630,CF_NIV_SUIV,CF_NIV_SUIV,False,True,False,,,CF_NIV_SUIV,True,,,,False,,,,,,CF_NIV_SUIV,,,CF_NIV_SUIV,,,,,,,,,CF_NIV_SUIV,,,,,,,,,,,CF_NIV_SUIV,True,,,,,CF_NIV_SUIV,[],CF_NIV_SUIV,2020-03-11 23:00:00,2020-03-31 22:00:00,CF_NIV_SUIV,,,,,"Compte tenu des dernières informations et consignes concernant le COVID-19, le pouvoir adjudicateur décide l'abandon de la consultation : Réhabilitation d'un ancien bâtiment industriel en Centre Technique Municipal - Travaux de réparation de façades en béton cellulaire. Les conditions de finalisation des offres étant fortement perturbées, et n'ayant nous même pas de visibilité sur une date de report de remise des offres raisonnable, nous préférons abandonner cette procédure afin d'éviter les risques tenant aux incertitudes qui peuvent affectées la consultation.Nous relancerons une nouvelle procédure dès que possible sur cette même plateforme. Comptant sur votre compréhension, nous vous invitons à rester en alerte pour vous tenir au courant de la nouvelle publication."
20-40832,CF_NIV_SUIV,CF_NIV_SUIV,20-34418,CF_NIV_SUIV,CF_NIV_SUIV,True,False,False,,,CF_NIV_SUIV,True,,,,False,,,,,,CF_NIV_SUIV,,,CF_NIV_SUIV,,,,,,,,,CF_NIV_SUIV,,,,,,,,,,,CF_NIV_SUIV,True,,,,,CF_NIV_SUIV,[],CF_NIV_SUIV,2020-03-05 23:00:00,2020-04-03 22:00:00,CF_NIV_SUIV,,,,,"Dans le contexte de la crise sanitaire liée au Coronavirus (Covid 19) en France et suite aux dernières mesures annoncées par le Président de la République le lundi 16 mars, et afin de respecter les principes de liberté d'accès à la commande publique et d'égalité de traitement entre les candidats, la procédure est déclarée sans suite pour motif d'intérêt général en application de l'article R 2185-1 du code de la commande publique."
20-41048,CF_NIV_SUIV,CF_NIV_SUIV,20-12641,CF_NIV_SUIV,CF_NIV_SUIV,True,False,False,,,CF_NIV_SUIV,True,,,,False,,,,,,CF_NIV_SUIV,,,CF_NIV_SUIV,,,,,,,,,CF_NIV_SUIV,,,,,,,,,,,CF_NIV_SUIV,True,,,,,CF_NIV_SUIV,[],CF_NIV_SUIV,2020-02-18 23:00:00,2020-03-11 23:00:00,CF_NIV_SUIV,,,,,"le marché est déclaré sans suite pour permettre la publication d'un nouvel avis d'appel public à la concurrence, avec son DCE mis à jour"
20-41131,CF_NIV_SUIV,CF_NIV_SUIV,20-28060,CF_NIV_SUIV,CF_NIV_SUIV,False,True,False,,,CF_NIV_SUIV,True,,,,False,,,,,,CF_NIV_SUIV,,,CF_NIV_SUIV,,,,,,,,,CF_NIV_SUIV,,,,,,,,,,,CF_NIV_SUIV,True,,,,,CF_NIV_SUIV,[],CF_NIV_SUIV,2020-02-23 23:00:00,2020-04-07 22:00:00,CF_NIV_SUIV,,,,,"En raison des nouvelles mesures gouvernementales afin de lutter contre l'épidémie COVID-19, nous vous informons que les visites obligatoires sont annulées, ainsi que la consultation pour le marché relatif au remplacement des gaines de ventilation endommagées des ouvrages et bâtiments de la station d'épuration de Saint-Thibault-des-Vignes. Ce marché public est donc déclaré sans suite.Une nouvelle consultation sera relancée dès que la situation sera rétablie."
20-41134,CF_NIV_SUIV,CF_NIV_SUIV,20-28197,CF_NIV_SUIV,CF_NIV_SUIV,False,True,False,,,CF_NIV_SUIV,True,,,,False,,,,,,CF_NIV_SUIV,,,CF_NIV_SUIV,,,,,,,,,CF_NIV_SUIV,,,,,,,,,,,CF_NIV_SUIV,True,,,,,CF_NIV_SUIV,[],CF_NIV_SUIV,2020-02-23 23:00:00,2020-04-07 22:00:00,CF_NIV_SUIV,,,,,"En raison des nouvelles mesures gouvernementales afin de lutter contre l'épidémie COVID-19, nous vous informons que les visites obligatoires sont annulées, ainsi que la consultation pour le marché relatif à la mise en conformité et au remplacement des lanterneaux des tranches T3 et T4 de la station d'épuration de Saint-Thibault-des-Vignes. Ce marché public est donc déclaré sans suite.Une nouvelle consultation sera relancée dès que la situation sera rétablie."
20-41275,CF_NIV_SUIV,CF_NIV_SUIV,20-33637,CF_NIV_SUIV,CF_NIV_SUIV,False,True,False,,,CF_NIV_SUIV,True,,,,False,,,,,,CF_NIV_SUIV,,,CF_NIV_SUIV,,,,,,,,,CF_NIV_SUIV,,,,,,,,,,,CF_NIV_SUIV,True,,,,,CF_NIV_SUIV,[],CF_NIV_SUIV,2020-03-04 23:00:00,2020-04-02 22:00:00,CF_NIV_SUIV,,,,,"Au vu du contexte sanitaire national et de l'annonce des mesures de confinement par le Président de la République le 16 mars 2020, nous vous informons que la consultation relative à la réhabilitation du château d'eau des Goths à Amilly est annulée. Les visites du site ne peuvent pas avoir lieu.Cette procédure sera relancée lorsque la situation sera redevenue normale"
20-42028,CF_NIV_SUIV,CF_NIV_SUIV,20-40097,CF_NIV_SUIV,CF_NIV_SUIV,False,True,False,,,CF_NIV_SUIV,True,,,,False,,,,,,CF_NIV_SUIV,,,CF_NIV_SUIV,,,,,,,,,CF_NIV_SUIV,,,,,,,,,,,CF_NIV_SUIV,True,,,,,CF_NIV_SUIV,[],CF_NIV_SUIV,2020-03-15 23:00:00,2020-05-04 22:00:00,CF_NIV_SUIV,,,,,Le pouvoir adjudicateur a décidé de modifier le cahier des charges.
20-42319,CF_NIV_SUIV,CF_NIV_SUIV,20-28840,CF_NIV_SUIV,CF_NIV_SUIV,True,False,False,,,CF_NIV_SUIV,True,,,,False,,,,,,CF_NIV_SUIV,,,CF_NIV_SUIV,,,,,,,,,CF_NIV_SUIV,,,,,,,,,,,CF_NIV_SUIV,True,,,,,CF_NIV_SUIV,[],CF_NIV_SUIV,2020-02-24 23:00:00,2020-04-21 22:00:00,CF_NIV_SUIV,,,,,"Bonjour,Compte tenu du contexte sanitaire exceptionnel et afin de préserver l'égalité entre les candidats la procédure nommée ci-dessus est annulée. Néanmoins cette consultation sera relancée ultérieurement.Nous vous remercions pour votre compréhension,Cordialement"
