BOAMP_AVIS_NUM,D_10_01_Annulation_Annulinfoannonceanterieur,D_10_01_01_Annulation_Annulinfoannonceanterieur_Reference,D_10_01_01_01_Annulation_Annulinfoannonceanterieur_Reference_Idweb,D_10_01_01_02_Annulation_Annulinfoannonceanterieur_Reference_Typeavis,D_10_01_01_02_01_Annulation_Annulinfoannonceanterieur_Reference_Typeavis_Famille,D_10_01_01_02_01_01_Annulation_Annulinfoannonceanterieur_Reference_Typeavis_Famille_Mapa,D_10_01_01_02_01_02_Annulation_Annulinfoannonceanterieur_Reference_Typeavis_Famille_Fns,D_10_01_01_02_01_03_Annulation_Annulinfoannonceanterieur_Reference_Typeavis_Famille_Joue,D_10_01_01_02_01_04_Annulation_Annulinfoannonceanterieur_Reference_Typeavis_Famille_Dsp,D_10_01_01_02_01_05_Annulation_Annulinfoannonceanterieur_Reference_Typeavis_Famille_Divers,D_10_01_01_02_02_Annulation_Annulinfoannonceanterieur_Reference_Typeavis_Perimetre,D_10_01_01_02_02_01_Annulation_Annulinfoannonceanterieur_Reference_Typeavis_Perimetre_Cmp2006,D_10_01_01_02_02_02_Annulation_Annulinfoannonceanterieur_Reference_Typeavis_Perimetre_Cmp2006DEFENSE,D_10_01_01_02_02_03_Annulation_Annulinfoannonceanterieur_Reference_Typeavis_Perimetre_Directive18,D_10_01_01_02_02_04_Annulation_Annulinfoannonceanterieur_Reference_Typeavis_Perimetre_Directive17,D_10_01_01_02_02_05_Annulation_Annulinfoannonceanterieur_Reference_Typeavis_Perimetre_Directive81,D_10_01_01_02_02_06_Annulation_Annulinfoannonceanterieur_Reference_Typeavis_Perimetre_Directive23,D_10_01_01_02_02_07_Annulation_Annulinfoannonceanterieur_Reference_Typeavis_Perimetre_Directive24,D_10_01_01_02_02_08_Annulation_Annulinfoannonceanterieur_Reference_Typeavis_Perimetre_Directive25,D_10_01_01_02_02_09_Annulation_Annulinfoannonceanterieur_Reference_Typeavis_Perimetre_Dsp,D_10_01_01_02_02_10_Annulation_Annulinfoannonceanterieur_Reference_Typeavis_Perimetre_Autre,D_10_01_01_02_03_Annulation_Annulinfoannonceanterieur_Reference_Typeavis_Nature,D_10_01_01_02_03_01_Annulation_Annulinfoannonceanterieur_Reference_Typeavis_Nature_Preinformation,D_10_01_01_02_03_02_Annulation_Annulinfoannonceanterieur_Reference_Typeavis_Nature_Profilacheteur,D_10_01_01_02_03_03_Annulation_Annulinfoannonceanterieur_Reference_Typeavis_Nature_Appeloffre,D_10_01_01_02_03_03_01_Annulation_Annulinfoannonceanterieur_Reference_Typeavis_Nature_Appeloffre_Standard,D_10_01_01_02_03_03_02_Annulation_Annulinfoannonceanterieur_Reference_Typeavis_Nature_Appeloffre_Concours,D_10_01_01_02_03_03_03_Annulation_Annulinfoannonceanterieur_Reference_Typeavis_Nature_Appeloffre_Periodique,D_10_01_01_02_03_03_04_Annulation_Annulinfoannonceanterieur_Reference_Typeavis_Nature_Appeloffre_Qualification,D_10_01_01_02_03_03_05_Annulation_Annulinfoannonceanterieur_Reference_Typeavis_Nature_Appeloffre_Sad,D_10_01_01_02_03_03_06_Annulation_Annulinfoannonceanterieur_Reference_Typeavis_Nature_Appeloffre_Concession,D_10_01_01_02_03_03_07_Annulation_Annulinfoannonceanterieur_Reference_Typeavis_Nature_Appeloffre_Concessionnaire,D_10_01_01_02_03_04_Annulation_Annulinfoannonceanterieur_Reference_Typeavis_Nature_Intentionconclure,D_10_01_01_02_03_05_Annulation_Annulinfoannonceanterieur_Reference_Typeavis_Nature_Attribution,D_10_01_01_02_03_05_01_Annulation_Annulinfoannonceanterieur_Reference_Typeavis_Nature_Attribution_Standard,D_10_01_01_02_03_05_02_Annulation_Annulinfoannonceanterieur_Reference_Typeavis_Nature_Attribution_Concours,D_10_01_01_02_03_05_03_Annulation_Annulinfoannonceanterieur_Reference_Typeavis_Nature_Attribution_Concession,D_10_01_01_02_03_05_04_Annulation_Annulinfoannonceanterieur_Reference_Typeavis_Nature_Attribution_Standardinfructueuxsanssuite,D_10_01_01_02_03_06_Annulation_Annulinfoannonceanterieur_Reference_Typeavis_Nature_Soustraitance,D_10_01_01_02_03_07_Annulation_Annulinfoannonceanterieur_Reference_Typeavis_Nature_Modification,D_10_01_01_02_03_08_Annulation_Annulinfoannonceanterieur_Reference_Typeavis_Nature_Qualification,D_10_01_01_02_03_09_Annulation_Annulinfoannonceanterieur_Reference_Typeavis_Nature_Rectificatif,D_10_01_01_02_03_10_Annulation_Annulinfoannonceanterieur_Reference_Typeavis_Nature_Periodique,D_10_01_01_02_03_11_Annulation_Annulinfoannonceanterieur_Reference_Typeavis_Nature_Autre,D_10_01_01_02_04_Annulation_Annulinfoannonceanterieur_Reference_Typeavis_Statut,D_10_01_01_02_04_01_Annulation_Annulinfoannonceanterieur_Reference_Typeavis_Statut_Initial,D_10_01_01_02_04_02_Annulation_Annulinfoannonceanterieur_Reference_Typeavis_Statut_Rectificatif,D_10_01_01_02_04_03_Annulation_Annulinfoannonceanterieur_Reference_Typeavis_Statut_Annulation,D_10_01_01_02_04_04_Annulation_Annulinfoannonceanterieur_Reference_Typeavis_Statut_Modification,D_10_01_01_03_Annulation_Annulinfoannonceanterieur_Reference_Dateenvoi,D_10_01_02_Annulation_Annulinfoannonceanterieur_Referencepublication,D_10_01_02_01_Annulation_Annulinfoannonceanterieur_Referencepublication_Publicationpapier,D_10_01_02_02_Annulation_Annulinfoannonceanterieur_Referencepublication_Publicationelectronique,D_10_01_02_02_01_Annulation_Annulinfoannonceanterieur_Referencepublication_Publicationelectronique_Datepublication,D_10_01_02_02_02_Annulation_Annulinfoannonceanterieur_Referencepublication_Publicationelectronique_Datefindiffusion,D_10_01_02_03_Annulation_Annulinfoannonceanterieur_Referencepublication_Publicationjoue,D_10_01_02_03_01_Annulation_Annulinfoannonceanterieur_Referencepublication_Publicationjoue_Annee,D_10_01_02_03_02_Annulation_Annulinfoannonceanterieur_Referencepublication_Publicationjoue_Numparution,D_10_01_02_03_03_Annulation_Annulinfoannonceanterieur_Referencepublication_Publicationjoue_Numannonce,D_10_01_02_03_04_Annulation_Annulinfoannonceanterieur_Referencepublication_Publicationjoue_Datepublication,D_10_02_Annulation_Motif
20-107402,CF_NIV_SUIV,CF_NIV_SUIV,20-105817,CF_NIV_SUIV,CF_NIV_SUIV,False,True,False,,,CF_NIV_SUIV,True,,,,False,,,,,,CF_NIV_SUIV,,,CF_NIV_SUIV,,,,,,,,,CF_NIV_SUIV,,,,,,,,,,,CF_NIV_SUIV,True,,,,,CF_NIV_SUIV,[],CF_NIV_SUIV,1598565600000,2020-09-14 22:00:00,CF_NIV_SUIV,,,,,Consultation initiale fructueuse et actuellement en cours d'analyse.
20-107656,CF_NIV_SUIV,CF_NIV_SUIV,20-100322,CF_NIV_SUIV,CF_NIV_SUIV,True,False,False,,,CF_NIV_SUIV,True,,,,False,,,,,,CF_NIV_SUIV,,,CF_NIV_SUIV,,,,,,,,,CF_NIV_SUIV,,,,,,,,,,,CF_NIV_SUIV,True,,,,,CF_NIV_SUIV,[],CF_NIV_SUIV,1596751200000,2020-09-29 22:00:00,CF_NIV_SUIV,,,,,"Conformément aux dispositions des articles R. 2185-1 et R. 2385-1 du code de la commande publique, la procédure est déclarée sans suite. En effet, au cours de la présente consultation, le rapport de recherche amiante avant travaux concernant la réfection des façades de la grange du Prieuré a été réceptionné et a permis d'établir que les modénatures en plâtre de deux façades sont recouvertes de peinture contenant de l'amiante. Le cahier des charges sur la base duquel la consultation a été lancée doit être redéfini."
20-107772,CF_NIV_SUIV,CF_NIV_SUIV,19-149963,CF_NIV_SUIV,CF_NIV_SUIV,True,False,False,,,CF_NIV_SUIV,True,,,,False,,,,,,CF_NIV_SUIV,,,CF_NIV_SUIV,,,,,,,,,CF_NIV_SUIV,,,,,,,,,,,CF_NIV_SUIV,True,,,,,CF_NIV_SUIV,[],CF_NIV_SUIV,1570053600000,2019-10-29 23:00:00,CF_NIV_SUIV,,,,,ERREUR DE SAISIE
20-108320,CF_NIV_SUIV,CF_NIV_SUIV,20-102281,CF_NIV_SUIV,CF_NIV_SUIV,False,True,False,,,CF_NIV_SUIV,True,,,,False,,,,,,CF_NIV_SUIV,,,CF_NIV_SUIV,,,,,,,,,CF_NIV_SUIV,,,,,,,,,,,CF_NIV_SUIV,True,,,,,CF_NIV_SUIV,[],CF_NIV_SUIV,1597356000000,2020-09-13 22:00:00,CF_NIV_SUIV,,,,,La consultation citée en objet est déclarée sans suite pour motif d'intérêt général. Des erreurs juridiques et techniques entachent la régularité de la procédure.
20-108352,CF_NIV_SUIV,CF_NIV_SUIV,20-106648,CF_NIV_SUIV,CF_NIV_SUIV,False,True,False,,,CF_NIV_SUIV,True,,,,False,,,,,,CF_NIV_SUIV,,,CF_NIV_SUIV,,,,,,,,,CF_NIV_SUIV,,,,,,,,,,,CF_NIV_SUIV,True,,,,,CF_NIV_SUIV,[],CF_NIV_SUIV,1598565600000,2020-10-27 23:00:00,CF_NIV_SUIV,,,,,"Décision sans suite du 1er septembre 2020 : suite à une erreur matérielle, deux consultations ont été créées pour l'achat correspondant au lot no3 sur le profil d'acheteur du Département Maximilien. Ces deux consultations ont été créées sous le même numéro 2020-DAP079 avec la même date limite de remise des offres. des candidats ont d'ores et déjà retiré le dossier des consultations des entreprises pour chacune de ces deux consultations et ce sont identifiés sur le profil d'acheteur du Département Maximilien."
20-109957,CF_NIV_SUIV,CF_NIV_SUIV,20-91676,CF_NIV_SUIV,CF_NIV_SUIV,False,True,False,,,CF_NIV_SUIV,True,,,,False,,,,,,CF_NIV_SUIV,,,CF_NIV_SUIV,,,,,,,,,CF_NIV_SUIV,,,,,,,,,,,CF_NIV_SUIV,True,,,,,CF_NIV_SUIV,[],CF_NIV_SUIV,1594936800000,2020-09-10 22:00:00,CF_NIV_SUIV,,,,,Considérant l'évolution technique du besoin (Déconstruction supplémentaire du bâtiment A2 impliquant une étude structure et réflexions sur le devenir du bâtiment A1) ;Considérant la nécessité de modifier substantiellement le dossier de consultation propre à la procédure initiale ; Considérant les échanges avec l'ensemble des partenaires du projet.La présente consultation est déclarée sans suite.
20-110928,CF_NIV_SUIV,CF_NIV_SUIV,20-110448,CF_NIV_SUIV,CF_NIV_SUIV,False,True,False,,,CF_NIV_SUIV,True,,,,False,,,,,,CF_NIV_SUIV,,,CF_NIV_SUIV,,,,,,,,,CF_NIV_SUIV,,,,,,,,,,,CF_NIV_SUIV,True,,,,,CF_NIV_SUIV,[],CF_NIV_SUIV,1599516000000,2020-09-24 22:00:00,CF_NIV_SUIV,,,,,"En raison d'un grand nombre d'incohérence dans la publication, la présente parution est annulée et une nouvelle publication sera fait dès rectification"
20-112310,CF_NIV_SUIV,CF_NIV_SUIV,20-74004,CF_NIV_SUIV,CF_NIV_SUIV,False,True,False,,,CF_NIV_SUIV,True,,,,False,,,,,,CF_NIV_SUIV,,,CF_NIV_SUIV,,,,,,,,,CF_NIV_SUIV,,,,,,,,,,,CF_NIV_SUIV,True,,,,,CF_NIV_SUIV,[],CF_NIV_SUIV,1591653600000,2020-06-29 22:00:00,CF_NIV_SUIV,,,,,"En application de l'article R.2185-1 du Code de la Commande Publique, l'acheteur a décidé de ne pas donner suite à la procédure de passation au motif suivant : modification substantielle du dossier de consultation nécessitant le recours à une nouvelle procédure de consultation. En effet, l'acheteur a décidé d'allotir le marché en fonction des caractéristiques techniques distinctes des prestations."
20-112466,CF_NIV_SUIV,CF_NIV_SUIV,20-109125,CF_NIV_SUIV,CF_NIV_SUIV,False,True,False,,,CF_NIV_SUIV,True,,,,False,,,,,,CF_NIV_SUIV,,,CF_NIV_SUIV,,,,,,,,,CF_NIV_SUIV,,,,,,,,,,,CF_NIV_SUIV,True,,,,,CF_NIV_SUIV,[],CF_NIV_SUIV,-61514730000000,2020-10-04 22:00:00,CF_NIV_SUIV,,,,,La consultation est déclarée sans suite et sera relancée ultérieurement
20-112786,CF_NIV_SUIV,CF_NIV_SUIV,20-85458,CF_NIV_SUIV,CF_NIV_SUIV,False,True,False,,,CF_NIV_SUIV,True,,,,False,,,,,,CF_NIV_SUIV,,,CF_NIV_SUIV,,,,,,,,,CF_NIV_SUIV,,,,,,,,,,,CF_NIV_SUIV,True,,,,,CF_NIV_SUIV,[],CF_NIV_SUIV,1593727200000,2020-07-29 22:00:00,CF_NIV_SUIV,,,,,"En application des articles R. 2185-1 et R. 2385-1 du code de la commande publique, le pouvoir adjudicateur déclare la consultation sans suite pour motifs techniques.En effet, la découverte d'amiante dans de nouveaux éléments du bâti de la Chambre régionale des comptes de Corse, modifie fortement le mode opératoire et la consistance des travaux nécessaires."
20-113636,CF_NIV_SUIV,CF_NIV_SUIV,19-192497,CF_NIV_SUIV,CF_NIV_SUIV,False,True,False,,,CF_NIV_SUIV,True,,,,False,,,,,,CF_NIV_SUIV,,,CF_NIV_SUIV,,,,,,,,,CF_NIV_SUIV,,,,,,,,,,,CF_NIV_SUIV,True,,,,,CF_NIV_SUIV,[],CF_NIV_SUIV,1577401200000,2020-01-23 23:00:00,CF_NIV_SUIV,,,,,"Je suis au regret de vous informer qu'en vertu des articles R.2185-1 et R.2185-2 du code de la Commande Publique, je déclare sans suite la consultation du marché 2019-01 pour un motif d'intérêt général. En l'espèce, le motif est d'ordre budgétaire ; le projet de création d'un centre technique municipal est donc reporté."
20-115381,CF_NIV_SUIV,CF_NIV_SUIV,20-112206,CF_NIV_SUIV,CF_NIV_SUIV,False,True,False,,,CF_NIV_SUIV,True,,,,False,,,,,,CF_NIV_SUIV,,,CF_NIV_SUIV,,,,,,,,,CF_NIV_SUIV,,,,,,,,,,,CF_NIV_SUIV,True,,,,,CF_NIV_SUIV,[],CF_NIV_SUIV,1600293600000,2020-10-11 22:00:00,CF_NIV_SUIV,,,,,La présente consultation est annulée pour des raisons techniques liées à la mise en ligne des pièces du dossier de consultation. Une prochaine consultation sera mise en ligne prochainement.
20-116044,CF_NIV_SUIV,CF_NIV_SUIV,20-107210,CF_NIV_SUIV,CF_NIV_SUIV,False,True,False,,,CF_NIV_SUIV,True,,,,False,,,,,,CF_NIV_SUIV,,,CF_NIV_SUIV,,,,,,,,,CF_NIV_SUIV,,,,,,,,,,,CF_NIV_SUIV,True,,,,,CF_NIV_SUIV,[],CF_NIV_SUIV,1598824800000,2020-10-04 22:00:00,CF_NIV_SUIV,,,,,"Motif d'intérêt général : la consultation sera relancée. Le nouveau CCTP tiendra compte de nouvelles exigences, notamment en matière de développement durable."
20-116814,CF_NIV_SUIV,CF_NIV_SUIV,20-116669,CF_NIV_SUIV,CF_NIV_SUIV,True,False,False,,,CF_NIV_SUIV,True,,,,False,,,,,,CF_NIV_SUIV,,,CF_NIV_SUIV,,,,,,,,,CF_NIV_SUIV,,,,,,,,,,,CF_NIV_SUIV,True,,,,,CF_NIV_SUIV,[],CF_NIV_SUIV,1600898400000,2020-10-27 23:00:00,CF_NIV_SUIV,,,,,"Erreur de formulaire, montant supérieur à 90 000 euro HT."
20-116892,CF_NIV_SUIV,CF_NIV_SUIV,20-112555,CF_NIV_SUIV,CF_NIV_SUIV,True,False,False,,,CF_NIV_SUIV,True,,,,False,,,,,,CF_NIV_SUIV,,,CF_NIV_SUIV,,,,,,,,,CF_NIV_SUIV,,,,,,,,,,,CF_NIV_SUIV,True,,,,,CF_NIV_SUIV,[],CF_NIV_SUIV,1600034400000,2020-11-29 23:00:00,CF_NIV_SUIV,,,,,Motif d'intérêt général
20-117403,CF_NIV_SUIV,CF_NIV_SUIV,20-114193,CF_NIV_SUIV,CF_NIV_SUIV,True,False,False,,,CF_NIV_SUIV,True,,,,False,,,,,,CF_NIV_SUIV,,,CF_NIV_SUIV,,,,,,,,,CF_NIV_SUIV,,,,,,,,,,,CF_NIV_SUIV,True,,,,,CF_NIV_SUIV,[],CF_NIV_SUIV,1600293600000,2020-10-13 22:00:00,CF_NIV_SUIV,,,,,erreur de procédure Devis et non MAPA
20-117905,CF_NIV_SUIV,CF_NIV_SUIV,20-117430,CF_NIV_SUIV,CF_NIV_SUIV,False,True,False,,,CF_NIV_SUIV,True,,,,False,,,,,,CF_NIV_SUIV,,,CF_NIV_SUIV,,,,,,,,,CF_NIV_SUIV,,,,,,,,,,,CF_NIV_SUIV,True,,,,,CF_NIV_SUIV,[],CF_NIV_SUIV,1600984800000,2020-10-22 22:00:00,CF_NIV_SUIV,,,,,La procédure engagée est annulée en raison des conséquences de l'épidémie de COVID-19 sur le poste budgétaire 202 affecté au financement du projet de rénovation.
20-118655,CF_NIV_SUIV,CF_NIV_SUIV,18-91918,CF_NIV_SUIV,CF_NIV_SUIV,False,True,False,,,CF_NIV_SUIV,True,,,,False,,,,,,CF_NIV_SUIV,,,CF_NIV_SUIV,,,,,,,,,CF_NIV_SUIV,,,,,,,,,,,CF_NIV_SUIV,True,,,,,CF_NIV_SUIV,[],CF_NIV_SUIV,1530482400000,2018-07-08 22:00:00,CF_NIV_SUIV,,,,,erreur de procédure
20-118680,CF_NIV_SUIV,CF_NIV_SUIV,20-25844,CF_NIV_SUIV,CF_NIV_SUIV,False,True,False,,,CF_NIV_SUIV,True,,,,False,,,,,,CF_NIV_SUIV,,,CF_NIV_SUIV,,,,,,,,,CF_NIV_SUIV,,,,,,,,,,,CF_NIV_SUIV,True,,,,,CF_NIV_SUIV,[],CF_NIV_SUIV,1582066800000,2020-04-17 22:00:00,CF_NIV_SUIV,,,,,"En application des dispositions des articles R2185-1 et R2185-2 du code de la commande publique, la consultation a été déclarée sans suite pour cause d'infructuosité dans la mesure où seule une offre, déclarée irrégulière, a été reçue par le pouvoir adjudicateur dans les délais impartis."
20-119410,CF_NIV_SUIV,CF_NIV_SUIV,20-119131,CF_NIV_SUIV,CF_NIV_SUIV,False,True,False,,,CF_NIV_SUIV,True,,,,False,,,,,,CF_NIV_SUIV,,,CF_NIV_SUIV,,,,,,,,,CF_NIV_SUIV,,,,,,,,,,,CF_NIV_SUIV,True,,,,,CF_NIV_SUIV,[],CF_NIV_SUIV,1601416800000,2020-10-29 23:00:00,CF_NIV_SUIV,,,,,Doit également être publié au JOUE (appel d'offres ouvert)
20-119454,CF_NIV_SUIV,CF_NIV_SUIV,20-46026,CF_NIV_SUIV,CF_NIV_SUIV,False,True,False,,,CF_NIV_SUIV,True,,,,False,,,,,,CF_NIV_SUIV,,,CF_NIV_SUIV,,,,,,,,,CF_NIV_SUIV,,,,,,,,,,,CF_NIV_SUIV,True,,,,,CF_NIV_SUIV,[],CF_NIV_SUIV,1585263600000,2020-04-26 22:00:00,CF_NIV_SUIV,,,,,"Nouvelle stratégie politique suite aux élections qui demande une remise à plat complète du réseau des déchèteries de la collectivité, dans un contexte de forte hausse du coût de traitement des déchets menaçant l'équilibre budgétaire du SYMAT."
